,User Name,Heading,Rating,Review
196,Yeswanth Pavan Kumar Bandaru,Not good,5,"Camera is very good and performance is awesome. charging is slow, overall very good mobile at this price range. Xr is my first iPhone.READ MORE"
197,Amit Sharma,Worth every penny,5,Nice phone with high speed great camera nd most important got only 35999/-READ MORE
198,Sai Ram V,Awesome,5,Brilliant Device. Charging is coming for 1 and half day. Price is a bit high. Camera is not quite up to the mark.  Performance wise it’s a beast. No heating issues.Packing is poor.READ MORE
199,Dibyajyoti Oja,Terrific purchase,2,Great value for money.READ MORE
200,Abdul jaleel,Simply awesome,5,simple and super but expensive.. fluid OS and it's great.READ MORE
201,Chandra Mauli,Value-for-money,4,Performance and battery life is awesome.Wouldn’t miss telephoto lenseREAD MORE
202,Flipkart Customer,Good quality product,4,Camera -🌟🌟🌟🌟Performance -🌟🌟🌟🌟Design -🌟🌟🌟Software Update -🌟🌟🌟🌟🌟Available Colours -🌟🌟🌟🌟Battery -🌟🌟🌟🌟iOS - 🌟🌟🌟🌟🌟READ MORE
203,Flipkart Customer,Brilliant,5,Go for it...I know you will be jumping between one plus 8 and iphone XRTrust me this is a better choice.This phone not only gives u a good performance but class.PS-Android can never beat ios.READ MORE
204,Rakesh Garg,Worst experience ever!,5,"The brand new iPhone XR went dead within 2 weeks of purchase! After spending so much money in buying a top of the line product, one doesn't expect this. And I'm left stranded without a phone while dealing with a personal emergency.Further, the Apple help line or service centre are not open on Sundays. I expected more from Apple if they're serious about the Indian market and if they have to charge a premium for their products.READ MORE"
205,Ranjan Kumar jha,Classy product,5,Still best iPhone in this price rangeREAD MORE
206,Nitin Bhardwaj,Wonderful,5,Nice phone .READ MORE
207,Lokesh Jangid,Mind-blowing purchase,4,This is an amazing phone. Camera and performance is  awesome.READ MORE
208,Manish  Jha,Pretty good,5,The product is genuine and services is good but only problem is that the Flipkart shows the high price when we add an exchange phone but when the dilevery boy arrives at home he offers such a low price. This needs to be improved.READ MORE
209,Sai Nikith Reddy,Mind-blowing purchase,1,Nice product .READ MORE
210,Sarthak Sourav Panda,Classy product,5,Everything is Gud but apple should include a fast Charger in the boxREAD MORE
211,Praveen  Kumar,Classy product,5,Best phone in valid priceREAD MORE
212,Harpal Bhati,Awesome,5,Awesome phone . Got 128 gb in 46kREAD MORE
213,Flipkart Customer,Terrific purchase,5,Original product. Working fine. Never seen fastest delivery before than this even when it was raining in Mumbai.READ MORE
214,Mohit Kumar,MRP is lower then the website showing.,4,I just got my new iphone but its price is different rather then mentioned in the page.The price got overnight from 49000 to 52500.READ MORE
215,Saksham Chamoli,Perfect product!,5,Worth iPhone in this price range.iPhone xr is really amazing guys.....READ MORE
216,Sasi Mandapati,Nice product,4,Value for money and good batteryREAD MORE
217,Rajaram Govindarasu,Really Nice,4,comfort for handlingREAD MORE
218,Flipkart Customer,Fabulous!,5,Nice product with in a day got delivered..READ MORE
219,Flipkart Customer,Mind-blowing purchase,5,good dvcREAD MORE
220,Shafeek M,Worth every penny,5,Bought this for my wife. I use an iPhoneX and this one is much faster than X. Had doubts about display quality as it is LCD and low resolution. Trust me we don’t feel much difference. In fact visibility under sunlight is much better. Even though camera is single it is better than X. Only drawback is that we cannot take portrait pics of objects. It’s algorithm needs human face for portraits.READ MORE
221,Shivraj  Rathod ,Don't waste your money,5,Worst product. Don’t buy this onlineREAD MORE
222,Himanshu Pratap Singh,Awesome,5,Ultimate price ....ultimate mobile....excellent deal given by flipkart but very Less No of unit to sell.many offer to be given in may b given near FutureREAD MORE
223,Flipkart Customer,Highly recommended,5,"Iphone XR is better than other phone,i purchased black is very nice.READ MORE"
224,Flipkart Customer,Terrible product,5,I don knw why my phone is giving me trouble....i hope flipkart didn’t cheat and gave me a refurbished item by saying fresh item...coz I phone doesn’t trouble this much n dat too at this early stage l..READ MORE
225,Flipkart Customer,Terrific purchase,5,best 10th generation iPhone models in affordable price and high performance processor (A12 bionic) by AppleREAD MORE
226,Sameer Suri,Great product,5,"I got this phone for 36000. I was worried about the hd display but its seriously the best phone I've ever had, especially the camera.READ MORE"
227,Mohammed Ghouse Pasha,Mind-blowing purchase,5,My first iPhone purchase looks great thanks flipcartREAD MORE
228,Nagendra Kumar,Terrific purchase,1,awesome phone ♥♥READ MORE
229,Ayan Mukherji,Highly recommended,1,"Very good phone if you are in apple ecosystem . Because if you consider price to specs , yes there are better performing android phones out there in that price . But if you are picking iphone xr because you use the apple ecosystem and you dont have budget for xs max ,then you are not gonna go wrong with it . The camera is awesome along with the battery life. You are getting the same processor as xs  i.e  A12 bionic .Gamers would not find any reason to regret.Sound output through the speakers ...READ MORE"
230,Flipkart Customer,Highly recommended,5,"I don’t regret buying this beast in 2020 .Its now a 2 year old beast but powerful. Iphone 11 and xr are similar devices basic difference is camera,battery,performance. Xr signifies its price. I play pubg alot it’s a beast in pubg. I play in hdr extreme but doesn’t lag like other android devices. Best point of apple is apple gives 5 year of updates. Iphone 6s is getting updates it’s a bit oldREAD MORE"
231,Flipkart Customer,Did not meet expectations,5,there was no exchange benefit.   flipkart didnt follow what they promised...  not happy.READ MORE
232,Sujoy Sarkar,Fabulous!,5,It's is love at first sight affair.....READ MORE
233,Shantanu Madiwale,Terrific,5,It’s worth spending money on iPhone XR in 2020 too. If you wanna buy entry level iPhone go for this model not for SE 2020. It has everything and will meet your expectations for next 3 year I hope. It’s very well build and feels complete phone.READ MORE
234,Kartikey Sharma,Fabulous!,5,AmazingREAD MORE
235,Flipkart Customer,Best in the market!,5,Nice delivery by Flipkart and 10/10 in apple xrREAD MORE
236,Flipkart Customer,Fabulous!,5,"Best value for money product from Apple. Bought it for 43k by using HDFC credit card and with the discount. Whoever wants to buy an iPhone in 2020 and also wanna save some bucks, go for XR instead 11.READ MORE"
237,Shamsher Singh,Perfect product!,5,AwesomeREAD MORE
238,siddhesh shinde,Just wow!,4,Awesome mobile for pubg playerREAD MORE
239,Flipkart Customer,Wonderful,1,1st time using iphone and i love it. I gave 5* to the phone but i’m disappointed that it didn’t comes with the bubble wrap.READ MORE
240,Baljeet Singh,Awesome,5,"Phone has awesome battery life, ios experience good potrait camera and complete iPhone experience. Glass designs looking beautiful.READ MORE"
241,PRABHAT RATAN,Utterly Disappointed,5,highly heated up when using it.READ MORE
242,Vallabh Pujari,Highly recommended,5,"Got it for 36K in Big Billion Days , Best IPhone with powerful batteryREAD MORE"
243,Flipkart Customer,Super!,4,Thank you FlipkartREAD MORE
244,prakriti mukherjee,Slightly disappointed,5,The mobile have problem since I bought it. I have recorded some videos and they don't have sound. So please if you buy it check it the moment you get it in your hand.READ MORE
245,Ansh Shukla,Really Nice,5,fabulous it's too good display is just like crazy lcdREAD MORE
246,Flipkart Customer,Absolute rubbish!,5,Died after 2 months of purchaseREAD MORE
247,Alok Singh,Must buy!,2,GreatREAD MORE
248,Abdul rehamaan,Awesome,1,I am an Iphone 7plus user Past Confused Between the Xr and Xs Display and Decided To Take Xr In Big Saving Days 😉The Display was More Better than The old Iphone 7 plus Display 🤓Go for This Than Iphone 11 because Only Camera Is Different..So Buy an Dslr and Take iphone xr 😋READ MORE
249,Aditya Arya,Must buy!,1,nice.READ MORE
250,Flipkart Customer,Perfect product!,5,APPLE IS ALL TOGETHER A DIFFERENT BALL GAME.Smooth going till date after 6 months of use.READ MORE
251,Amartya Basu,Highly recommended,5,Leave aside the spec sheet for a while and use for a day you'll understand why an iPhone is an iPhoneexcellent delivery service by FlipkartREAD MORE
252,Karthick  Krishna,Excellent,5,No reviews required. Its a apple.READ MORE
253,Devraj  Munda,Fabulous!,5,Product is awesome and I'm first tym user of iPhone bcoz I'm using android phone last 9 years now I'm shift to IOS and it's OS is some simple and awesomeAccording to price 1:-camera 4/52:-display 5/53:-design 5/54:-battery 4.7/5READ MORE
254,Abhinav Tiwari,Classy product,5,Amazing phone. I was a little scared before ordering as I had seen a lot of reviews that said screen is lcd and not oled. But frankly can’t notice the difference. Battery life is amazing. Even after full day usage still half battery remaining. Perfect screen size. Go for it.READ MORE
255,Flipkart Customer,Really Nice,4,Good phone except display.READ MORE
256,Vicky  Gupta,Great product,5,Upgrade 6s to XR....amazing experience....for PUBG too good ....READ MORE
257,pavan  krishna,Just okay,3,Price is high i got in big saving day 128GB 50000/-READ MORE
258,Shrenik  Gandhi ,Fabulous!,5,Thanks flipkart. Got XR AT 42500 . My daughter loved it like anything.iPhone rocks .super value for MONEY at this price .READ MORE
259,Shashank  Shekhar ,Simply awesome,5,Awesome product from Apple just amazing and wow😍READ MORE
260,Manish Kumar,Must buy!,5,Great phone in 2020 even better than rog 3 also u can play 4 hrs pubg on higest setting in xr op phone op performance op battery op camera ip looksREAD MORE
261,Ashutosh Pradhan,Highly recommended,5,Undoubtedly best in everything. Go for it till 2022READ MORE
262,Omkar Salunke,Great product,5,Couldn't be more Happy. I have purchased this for my father and he couldn't contain his happiness.READ MORE
263,Ankit  Chauhan,Great product,5,"Just get it already if u have 45k u cant beat apples optimization and amazing ios expernce , i used samsung s and note series all my life shifted to iphone because its price went down theres no going back anytime soonREAD MORE"
264,vishwa saraf,Simply awesome,5,"The phone is undoubtedly perfect but, the delivery service is horrendous! E-kart needs so much improvements. I received the product 7 days after the promised date.READ MORE"
265,Rajeev MA,Terrific purchase,5,"I was a skeptical for buying this. But then, went ahead and bought after reviewing from the feedback here as well with some other reference!I was bogged down by a few negative comments ..Let me tell you, The phone will delight you with its  tone and texture!Go for it 100%.READ MORE"
266,Anushree Adhikari ,Wonderful,4,Fully satisfied. Good one. Camera quality and performance is also good. Don’t think twice. Just go for it.READ MORE
267,Manjeet%20Singh%20 Sihag,Best in the market!,5,"I bought this for my wife and this is the first time we are using iPhone and I must say it is amazing. I wife is fell in love with her new phone. There are so many things to explore in this phone. She has already spent a week and still hasn't explored all the features yet. According to her iPhone is much better than Android phone, be it a one plus also. Camera, Performance everything is just superb.READ MORE"
268,Hrushikesh  Jadhav,Terrific purchase,5,This is my first iphone.... I'm Very happy to purchase from flipkart....READ MORE
269,Manikanth Naidu Rayapureddy,Terrific purchase,5,Superb 😍READ MORE
270,Suresh vasanta ,Worth the money,4,Product wise everything fine from Flipkart..but coming to delivery service worst experience i have faced..better to improve your delivery services FlipkartREAD MORE
271,Vaibhav Sengar,Excellent,5,Powerful phone no doubtREAD MORE
272,Prashanth MS,Super!,5,"9-Dec-2019: The mobile is really good. Everyone knows the available function. I'm here to tell my experience. The mobile functions very smooth the only drawback is the MiC, the voice is not that great for the person who is receiving my call.READ MORE"
273,Nimesh Patel,Wonderful,5,Best phone at this pricdREAD MORE
274,Mohd Anzil,Great product,5,"my iphones proximity sensor stopped working within 4 days of delivery, now  its screen doesn’t turn off while callingREAD MORE"
275,Ritu Raj,Nice product,4,"1 week usage review .I got this in big billion for 38K. I upgraded from iPhone7.Battery backup is awesome, camera is good(night mode, ultra wide and potrait for objects or pets not there).Display is good.i only faced issue is when i switch on the internet from eSim and again switch back to physical sim the internet stops working, u have to restart the phone.READ MORE"
276,Krishna Mohan,Mind-blowing purchase,5,Excellent ! Don't doubt about the display .. even i have seen many review videos about it . No need to worry its absolutely fine u cant recognize the difference . All other features are good and the battery life is insane you are really gonna love it ! you wont regret after buying this iPhone XR .READ MORE
277,Achin Jain,Perfect product!,5,It’s really an amazing phone but the only con is the price is high otherwise it’s goodREAD MORE
278,Adharsh Vasu,Mind-blowing purchase,5,Good one. After watching a lot of reviews got this XR and it is absolutely amazing... I have updated from 6s so obviously battery is beast in this one. Worth a buy in 2020READ MORE
279,K.mallikarjun  Mallikarjun ,Great product,5,NYC mobile my first appleREAD MORE
280,Abhi Sahay,Pretty good,4,"Received Black 128 GB two days ago, replacement clause withdrawn by seller. Very poor packing by seller. The phone is a very good, specs are awesome. Shifted from android to iOS so getting used to. Camera and battery power is very good.Recommend to go for it.READ MORE"
281,Shubhrima Chakraborty,Highly recommended,5,"In one word it's Awesome. keep in mind if you have an iPhone, you have an I phone.READ MORE"
282,saripuri somasundar,Classy product,5,"iPhone is out standing. iPhone XR battery, built Quality, screen are out standingREAD MORE"
283,jitendra  prajapati ,Terrific purchase,5,nice mobile it's value for money thanks flipakartREAD MORE
284,Aagam Shah,Best in the market!,5,"Awesome Phone with great specs. Although the screen is LED, you don’t find it different from OLEDREAD MORE"
285,Abhijeet Patil,Classy product,5,tooo good.....and apple is apple ...brand is brand....READ MORE
286,Jagdish Chaudhary,Must buy!,5,Nice phone  &   it's original..😎READ MORE
287,Saurabh jain,Could be way better,5,Guys phone is fine but don’t buy mobile phones from flipkart. I asked them to pay through my credit card but at the time of delivery the swiping machine didn’t work. I had words with flipkart executive but he asked me to cancel the order. I had to pay the whole amount in cash.Also i didn’t get “lightning connector” as it was mentioned on the box but still it was not it inside the box.READ MORE
288,Sudip Singharay ,Terrific,3,"First off, the battery life is INCREDIBLE! This is the first phone I have used where I can get two days of use on one charge! I would regularly charge the ...READ MORE"
289,Shiva Padmanaban,Does the job,2,"I bought XR 128 gigs red variant with 10 percent HDFC discount. Delivery is slightly took more days. Packing is neat and good. Its recently imported phone. Performance is snappy and clean. Camera is good. Battery life is awesome. I get around 8 plus hour screen on time. Its way too bulky and weighs more. The main problem and serious problem is, it has got reception problem in LTE and WiFI. Signal strength sucks. I am kinda confused what to do. Have done a online research and found its common ...READ MORE"
290,Manu Panicker,Moderate,5,"Bad rating is not for the phone, phone is good I like it a lot, but for the delay it took Flipkart to deliver. Also the sale price and normal price is same now. Flipkart is just trying to fool people. I will never buy from Flipkart again.READ MORE"
291,Flipkart Customer,Super!,3,"The product is excellent. Normally people think why to invest so much when other options are available with similar features in low price. But the product quality and it's performance can only be felt once it is in hands. It's really "" owners pride,  neighbours envy""Utility for money. Loved itREAD MORE"
292,Vivek Rawat,Does the job,5,"UPDATEDon’t buy from flipkart. I really doubt the quality of phone sold. I am facing so many issues with my phone. The ram management is very poor. It can hardly keep apps in memory. Everytime I open an app in memory, it refreshes again. Also, I face issues with connectivity to wifi. Many times it doesn’t autoconnect to wifi if connection broke in between.I loved the camera. Only think I don’t like is the time it takes to charge. It takes almost around 2 and half hours to completely charg...READ MORE"
293,Flipkart Customer,Super!,3,Best iPhone for the price I got it for 39999 worth it. performance is so gud. heard that xr battery last long than any other iPhone serious but actually it's normal. phone weight is to heavy. over all the phone is osm just osm. if u want to by a iPhone for cheap price go ahead with xr.READ MORE
294,Kuldeep Singh,Fair,4,"Awesome handset, Camera is great. Battery backup is nice it works whole day in a single charge. only thing that bothers me is the bezels of this phone, even after this is a full screen phone i has a very thick bezel on all the sidesREAD MORE"
295,rahul singh,Good choice,5,superb and cool product.READ MORE
296,Deepak  Priyadarshi ,Terrific purchase,5,My First Iphone Amazing experience with IosREAD MORE
297,Ramiz Zaman,Mind-blowing purchase,5,Wonderful phone. I don't take much photos so lack of dual cameras doesn't bother me.It's a beast.READ MORE
298,Gaurav Joshi,Classy product,5,NiceREAD MORE
299,sukhi bhullar,Excellent,2,Awsm product by apple super..READ MORE
300,rahul gupta,Very poor,5,VERY BAD experience !READ MORE
301,Vinod Choudhary,Classy product,5,Very nice superb productREAD MORE
302,satyam nagpal,Best in the market!,5,Great phone....surely better then last year’s iphone 10 and better value than 10s.READ MORE
303,Sukru Swain,Best in the market!,5,Undoubtedly IOS is the best.READ MORE
304,Sudharshan  Eabi ,Great product,5,This is my 1st experience with iphone i never expect this kind of performance and thus is the best mobile I’ll ever used 100% value for moneyREAD MORE
305,Abhijeet,Must buy!,5,Best phone ever I broughtREAD MORE
306,Shreekara  Hs,Fabulous!,5,Awesome phone from AppleREAD MORE
307,Flipkart Customer,Highly recommended,5,Nice MoblieREAD MORE
308,subho dey,Terrific,5,Nice phoneREAD MORE
309,HIMANSHU BHATT,Wonderful,1,Just buy in 45k .. outstanding performance..some peoples think wide notches makes phone odd ...just do a trial seriously top class performance.. premium quality phone..READ MORE
310,Flipkart Customer,Perfect product!,5,Best iPhoneREAD MORE
311,Fesal  Khan,Must buy!,5,AwesomeREAD MORE
312,Suresh kumar,Great product,5,"Nice product,camera quality is good,it's very awesome , it's very nice performanceREAD MORE"
313,Harsh Dugtal,Simply awesome,5,"The best iPhone to get in 2020 if you don’t unnecessarily want multiple cameras. I have used the iPhone 11 previously, and honestly I don’t feel like I’m missing out on anything using the XR currently.READ MORE"
314,Saurabh .,Just wow!,5,Upgrade from android. Just one word awesome.No phone can beat iPhone. Got amazing deal get this in 34999READ MORE
315,Flipkart Customer,Good quality product,4,Phone works properly a star less for taking so much time for deliveryREAD MORE
316,Suraj Mondal,Simply awesome,5,Excellent.... Super fastGot it for 45000READ MORE
317,Madhan Kumar,Super!,5,Really Awsome 💟💟No words to say.. Only one word iphone 😍😍😍🤗😍🤗😍🤗😍🤗😍🤗😍🤗🤗🤗READ MORE
318,Tanveer  Ali khan (monu),Highly recommended,5,Amzing phone juss wroth it!😊READ MORE
319,Flipkart Customer,Highly recommended,5,Best cell phone in the market.... Must buy!!READ MORE
320,Pinku Laskar,Brilliant,5,Best experience for use....READ MORE
321,Rabikumar D V,Satisfied with Service and product delivery..,4,Received on time with good condition..READ MORE
322,Biswajit  Maity,Great product,5,Awasome phone Performance excellent Mind blowing purchase👍🏻👍🏻👍🏻👍🏻👍🏻👍🏻👍🏻READ MORE
323,Flipkart Customer,Worth every penny,5,Nice and apple first experience it's nice to use and camera is very clear 4k cameraREAD MORE
324,Flipkart Customer,Highly recommended,5,"A great phone! Dont choose SE, choose xrREAD MORE"
325,Abinasha Sahoo,Awesome,5,Value for moneyREAD MORE
326,Ashutosh kumar Bhakat,Best in the market!,5,Value for moneyREAD MORE
327,Flipkart Customer,Awesome,5,Awesome phone! Thanks Flipkart for fast delivery!READ MORE
328,Shivam tickoo,Terrific,5,This is a beast in every features believe meREAD MORE
329,Rishu  jaiswal,Perfect product!,5,Very nyc XR I think it's better then SE battery life is osm and also its performance is to good.... 😘😘READ MORE
330,Surabhi K,Brilliant,5,Good productREAD MORE
331,Flipkart Customer,Best in the market!,5,CoolREAD MORE
332,AFAK AHMED BAGWAN,Terrific,5,No Doubt !!! Owesome Phone :)READ MORE
333,Shahnawaz Rayeen,Really Nice,4,"Awesome performance, value for moneyREAD MORE"
334,Vijay Yadav,Wonderful,5,It has been an amazing experience. Switched from a pixel 2 and definitely feels like a solid upgrade.READ MORE
335,Flipkart Customer,Worth every penny,5,Good phoneREAD MORE
336,Sahil Chauhan,Best in the market!,5,Perfectt for iphone loverss....🤘🏻READ MORE
337,Akshay Shende,Delightful,4,The phone is awesome!!!!!!!!READ MORE
338,Flipkart Customer,Excellent,5,Awesome phone ...🤗🤗READ MORE
339,Flipkart Customer,Terrific,5,"Apple XR is perhaps the best among the iPhone. Great battery life, camera, touch, face unlock, sound quality, everything is awesome!READ MORE"
340,Venkatesh Mummidi,Worth every penny,5,"Excellent mobile... IOS feeling very smooth,Good camera, Face ID response superb. And thank you for Dual sim support (eSIM)READ MORE"
341,Flipkart Customer,Best in the market!,5,Worth the money.. my first phone into Apple😊READ MORE
342,RAMESH  Dhami,Terrific,5,It’s awesome yaar This is my sixth iPhone I could not tell u it’s features are amazing Go for it if u afford it Don’t waste ur money on XS XS MAX HAVING SAME FEATURE LOVE U APPLEREAD MORE
343,Ajay  Tiwari ,Best in the market!,5,"Super phone, nice battery backupREAD MORE"
344,Ezhil,Highly recommended,5,Awesome product. iPhone is always unique. Good camera quality. Outstanding performance.READ MORE
345,Arun Mohanan,Excellent,5,Really responsive phone no lag what so ever. Face ID is very accurate. Battery is the longest lasting o e compared to all smartphones I have recently ownedREAD MORE
346,Pravin Kumar,Good quality product,4,Nice product but a bit costly as per Indian market any it is also a status symbol as well hence not a issueREAD MORE
347,hitesh manwar,Simply awesome,5,ExceptionalREAD MORE
348,Flipkart Customer,Great product,5,Surprised by the delivery on the 3rd day of order. Genuine product. It gets heated occasionally during charging/using internet. Amazing performance and smooth functioning.READ MORE
349,HEMBROD BRAHMA,Super!,5,"Awesome phone... no display related issues... its same as other iphone xs, i phone x max... u can hardly find any differences... 1080p works in youtube videos, only 3d touch is missing which doesnt make any differences..battery life is just wow..READ MORE"
350,Dr Rabindra  Kumar ,Fabulous!,5,superbbbbbREAD MORE
351,Flipkart Customer,Utterly Disappointed,4,Was charged more than MRP mentioned on phone. Multiple complaint also does not resolve the issue. Flipkart hasn't refunded additional amount charged yet even after multiple follow ups.READ MORE
352,Nikhil Nikki,Very Good,5,Superbb mobile in this year 💕💕💕READ MORE
353,Flipkart Customer,Terrific,5,Superb very fine and timely delivery thanks flipkartREAD MORE
354,Mahendra  chouhan ,Simply awesome,5,"awesome phone, great performance, thank you apple and flipkartREAD MORE"
355,Flipkart Customer,Simply awesome,5,Expensive but extremely excellentREAD MORE
356,Flipkart Customer,Horrible,5,"Phone is not working, no backing up from icloud, unable to set up and there is no return optionREAD MORE"
357,SIVA SIVA,Wonderful,5,Move to Android to IOS My first iphone  superb verry happyREAD MORE
358,Ankur Verma,Great product,1,Thank you a good product for i phonr xrREAD MORE
359,Pragya  Fogla ,Brilliant,1,Loved the camera and look of the phone..!!!😍READ MORE
360,Manish Gupta,Classy product,5,"Amazing phone, not like other iphones where you need to shell out 1 lakh rupees... Totally value for money..... Looks amazingREAD MORE"
361,hemanth kumar,Bad quality,5,Ear phones are not working !READ MORE
362,Arun Kumar,Wonderful,5,HappyREAD MORE
363,SUHAIL RAJESH,Terrific purchase,5,Good product fast deliveryREAD MORE
364,Shyamalima Debbarma,Terrific,5,Nice product as expected. Fastest Ekart service. Thaks flipkart.READ MORE
365,Sayan Biswas,Terrific purchase,5,awesome pH nice Bettry backupREAD MORE
366,Prabhat Anand,Simply awesome,5,Display is not full HD like iphone X or XS. That’s the downside. Rest everything is as expectedREAD MORE
