,User Name,Heading,Rating,Review,tokens,tokens_seg,tokens_stem,review1
288,Sudip Singharay ,terrific,3,first off the battery life is incredible this is the first phone i have used where i can get two days of use on one charge i would regularly charge the ,"['first', 'off', 'the', 'battery', 'life', 'is', 'incredible', 'this', 'is', 'the', 'first', 'phone', 'i', 'have', 'used', 'where', 'i', 'can', 'get', 'two', 'days', 'of', 'use', 'on', 'one', 'charge', 'i', 'would', 'regularly', 'charge', 'the']","['first', 'off', 'the', 'battery', 'life', 'is', 'incredible', 'this', 'is', 'the', 'first', 'phone', 'i', 'have', 'used', 'where', 'i', 'can', 'get', 'two', 'days', 'of', 'use', 'on', 'one', 'charge', 'i', 'would', 'regularly', 'charge', 'the']","['first', 'batteri', 'life', 'incred', 'first', 'phone', 'use', 'get', 'two', 'day', 'use', 'one', 'charg', 'would', 'regularli', 'charg']",first batteri life incred first phone use get two day use one charg would regularli charg
289,Shiva Padmanaban,does the job,2,i bought xrgigs red variant withpercent hdfc discount delivery is slightly took more days packing is neat and good its recently imported phone performance is snappy and clean camera is good battery life is awesome i get aroundplus hour screen on time its way too bulky and weighs more the main problem and serious problem is it has got reception problem in lte and wifi signal strength sucks i am kinda confused what to do have done a online research and found its common ,"['i', 'bought', 'xrgigs', 'red', 'variant', 'withpercent', 'hdfc', 'discount', 'delivery', 'is', 'slightly', 'took', 'more', 'days', 'packing', 'is', 'neat', 'and', 'good', 'its', 'recently', 'imported', 'phone', 'performance', 'is', 'snappy', 'and', 'clean', 'camera', 'is', 'good', 'battery', 'life', 'is', 'awesome', 'i', 'get', 'aroundplus', 'hour', 'screen', 'on', 'time', 'its', 'way', 'too', 'bulky', 'and', 'weighs', 'more', 'the', 'main', 'problem', 'and', 'serious', 'problem', 'is', 'it', 'has', 'got', 'reception', 'problem', 'in', 'lte', 'and', 'wifi', 'signal', 'strength', 'sucks', 'i', 'am', 'kinda', 'confused', 'what', 'to', 'do', 'have', 'done', 'a', 'online', 'research', 'and', 'found', 'its', 'common']","['i', 'bought', 'xr', 'gigs', 'red', 'variant', 'with', 'percent', 'hdfc', 'discount', 'delivery', 'is', 'slightly', 'took', 'more', 'days', 'packing', 'is', 'neat', 'and', 'good', 'its', 'recently', 'imported', 'phone', 'performance', 'is', 'snappy', 'and', 'clean', 'camera', 'is', 'good', 'battery', 'life', 'is', 'awesome', 'i', 'get', 'around', 'plus', 'hour', 'screen', 'on', 'time', 'its', 'way', 'too', 'bulky', 'and', 'weighs', 'more', 'the', 'main', 'problem', 'and', 'serious', 'problem', 'is', 'it', 'has', 'got', 'reception', 'problem', 'in', 'lte', 'and', 'wifi', 'signal', 'strength', 'sucks', 'i', 'am', 'kinda', 'confused', 'what', 'to', 'do', 'have', 'done', 'a', 'online', 'research', 'and', 'found', 'its', 'common']","['bought', 'xr', 'gig', 'red', 'variant', 'percent', 'hdfc', 'discount', 'deliveri', 'slightli', 'took', 'day', 'pack', 'neat', 'good', 'recent', 'import', 'phone', 'perform', 'snappi', 'clean', 'camera', 'good', 'batteri', 'life', 'awesom', 'get', 'around', 'plu', 'hour', 'screen', 'time', 'way', 'bulki', 'weigh', 'main', 'problem', 'seriou', 'problem', 'got', 'recept', 'problem', 'lte', 'wifi', 'signal', 'strength', 'suck', 'kinda', 'confus', 'done', 'onlin', 'research', 'found', 'common']",bought xr gig red variant percent hdfc discount deliveri slightli took day pack neat good recent import phone perform snappi clean camera good batteri life awesom get around plu hour screen time way bulki weigh main problem seriou problem got recept problem lte wifi signal strength suck kinda confus done onlin research found common
290,Manu Panicker,moderate,5,bad rating is not for the phone phone is good i like it a lot but for the delay it took flipkart to deliver also the sale price and normal price is same now flipkart is just trying to fool people i will never buy from flipkart again,"['bad', 'rating', 'is', 'not', 'for', 'the', 'phone', 'phone', 'is', 'good', 'i', 'like', 'it', 'a', 'lot', 'but', 'for', 'the', 'delay', 'it', 'took', 'flipkart', 'to', 'deliver', 'also', 'the', 'sale', 'price', 'and', 'normal', 'price', 'is', 'same', 'now', 'flipkart', 'is', 'just', 'trying', 'to', 'fool', 'people', 'i', 'will', 'never', 'buy', 'from', 'flipkart', 'again']","['bad', 'rating', 'is', 'not', 'for', 'the', 'phone', 'phone', 'is', 'good', 'i', 'like', 'it', 'a', 'lot', 'but', 'for', 'the', 'delay', 'it', 'took', 'flip', 'kart', 'to', 'deliver', 'also', 'the', 'sale', 'price', 'and', 'normal', 'price', 'is', 'same', 'now', 'flip', 'kart', 'is', 'just', 'trying', 'to', 'fool', 'people', 'i', 'will', 'never', 'buy', 'from', 'flip', 'kart', 'again']","['bad', 'rate', 'not', 'phone', 'phone', 'good', 'like', 'lot', 'delay', 'took', 'flip', 'kart', 'deliv', 'also', 'sale', 'price', 'normal', 'price', 'flip', 'kart', 'tri', 'fool', 'peopl', 'never', 'buy', 'flip', 'kart']",bad rate not phone phone good like lot delay took flip kart deliv also sale price normal price flip kart tri fool peopl never buy flip kart
291,Flipkart Customer,super,3,the product is excellent normally people think why to invest so much when other options are available with similar features in low price but the product quality and its performance can only be felt once it is in hands its reallyowners prideneighbours envyutility for money loved it,"['the', 'product', 'is', 'excellent', 'normally', 'people', 'think', 'why', 'to', 'invest', 'so', 'much', 'when', 'other', 'options', 'are', 'available', 'with', 'similar', 'features', 'in', 'low', 'price', 'but', 'the', 'product', 'quality', 'and', 'its', 'performance', 'can', 'only', 'be', 'felt', 'once', 'it', 'is', 'in', 'hands', 'its', 'reallyowners', 'prideneighbours', 'envyutility', 'for', 'money', 'loved', 'it']","['the', 'product', 'is', 'excellent', 'normally', 'people', 'think', 'why', 'to', 'invest', 'so', 'much', 'when', 'other', 'options', 'are', 'available', 'with', 'similar', 'features', 'in', 'low', 'price', 'but', 'the', 'product', 'quality', 'and', 'its', 'performance', 'can', 'only', 'be', 'felt', 'once', 'it', 'is', 'in', 'hands', 'its', 'really', 'owners', 'pride', 'neighbours', 'envy', 'utility', 'for', 'money', 'loved', 'it']","['product', 'excel', 'normal', 'peopl', 'think', 'invest', 'much', 'option', 'avail', 'similar', 'featur', 'low', 'price', 'product', 'qualiti', 'perform', 'felt', 'hand', 'realli', 'owner', 'pride', 'neighbour', 'envi', 'util', 'money', 'love']",product excel normal peopl think invest much option avail similar featur low price product qualiti perform felt hand realli owner pride neighbour envi util money love
292,Vivek Rawat,does the job,5,updatedon’t buy from flipkart i really doubt the quality of phone sold i am facing so many issues with my phone the ram management is very poor it can hardly keep apps in memory everytime i open an app in memory it refreshes again also i face issues with connectivity to wifi many times it doesn’t autoconnect to wifi if connection broke in betweeni loved the camera only think i don’t like is the time it takes to charge it takes almost aroundand half hours to completely charg,"['updatedon', '’', 't', 'buy', 'from', 'flipkart', 'i', 'really', 'doubt', 'the', 'quality', 'of', 'phone', 'sold', 'i', 'am', 'facing', 'so', 'many', 'issues', 'with', 'my', 'phone', 'the', 'ram', 'management', 'is', 'very', 'poor', 'it', 'can', 'hardly', 'keep', 'apps', 'in', 'memory', 'everytime', 'i', 'open', 'an', 'app', 'in', 'memory', 'it', 'refreshes', 'again', 'also', 'i', 'face', 'issues', 'with', 'connectivity', 'to', 'wifi', 'many', 'times', 'it', 'doesn', '’', 't', 'autoconnect', 'to', 'wifi', 'if', 'connection', 'broke', 'in', 'betweeni', 'loved', 'the', 'camera', 'only', 'think', 'i', 'don', '’', 't', 'like', 'is', 'the', 'time', 'it', 'takes', 'to', 'charge', 'it', 'takes', 'almost', 'aroundand', 'half', 'hours', 'to', 'completely', 'charg']","['updated', 'on', 't', 'buy', 'from', 'flip', 'kart', 'i', 'really', 'doubt', 'the', 'quality', 'of', 'phone', 'sold', 'i', 'am', 'facing', 'so', 'many', 'issues', 'with', 'my', 'phone', 'the', 'ram', 'management', 'is', 'very', 'poor', 'it', 'can', 'hardly', 'keep', 'apps', 'in', 'memory', 'every', 'time', 'i', 'open', 'an', 'app', 'in', 'memory', 'it', 'refreshes', 'again', 'also', 'i', 'face', 'issues', 'with', 'connectivity', 'to', 'wifi', 'many', 'times', 'it', 'doesn', 't', 'autoconnect', 'to', 'wifi', 'if', 'connection', 'broke', 'in', 'between', 'i', 'loved', 'the', 'camera', 'only', 'think', 'i', 'don', 't', 'like', 'is', 'the', 'time', 'it', 'takes', 'to', 'charge', 'it', 'takes', 'almost', 'around', 'and', 'half', 'hours', 'to', 'completely', 'charg']","['updat', 'buy', 'flip', 'kart', 'realli', 'doubt', 'qualiti', 'phone', 'sold', 'face', 'mani', 'issu', 'phone', 'ram', 'manag', 'poor', 'hardli', 'keep', 'app', 'memori', 'everi', 'time', 'open', 'app', 'memori', 'refresh', 'also', 'face', 'issu', 'connect', 'wifi', 'mani', 'time', 'autoconnect', 'wifi', 'connect', 'broke', 'love', 'camera', 'think', 'like', 'time', 'take', 'charg', 'take', 'almost', 'around', 'half', 'hour', 'complet', 'charg']",updat buy flip kart realli doubt qualiti phone sold face mani issu phone ram manag poor hardli keep app memori everi time open app memori refresh also face issu connect wifi mani time autoconnect wifi connect broke love camera think like time take charg take almost around half hour complet charg
293,Flipkart Customer,super,3,best iphone for the price i got it forworth it performance is so gud heard that xr battery last long than any other iphone serious but actually its normal phone weight is to heavy over all the phone is osm just osm if u want to by a iphone for cheap price go ahead with xr,"['best', 'iphone', 'for', 'the', 'price', 'i', 'got', 'it', 'forworth', 'it', 'performance', 'is', 'so', 'gud', 'heard', 'that', 'xr', 'battery', 'last', 'long', 'than', 'any', 'other', 'iphone', 'serious', 'but', 'actually', 'its', 'normal', 'phone', 'weight', 'is', 'to', 'heavy', 'over', 'all', 'the', 'phone', 'is', 'osm', 'just', 'osm', 'if', 'u', 'want', 'to', 'by', 'a', 'iphone', 'for', 'cheap', 'price', 'go', 'ahead', 'with', 'xr']","['best', 'i', 'phone', 'for', 'the', 'price', 'i', 'got', 'it', 'for', 'worth', 'it', 'performance', 'is', 'so', 'gud', 'heard', 'that', 'xr', 'battery', 'last', 'long', 'than', 'any', 'other', 'i', 'phone', 'serious', 'but', 'actually', 'its', 'normal', 'phone', 'weight', 'is', 'to', 'heavy', 'over', 'all', 'the', 'phone', 'is', 'osm', 'just', 'osm', 'if', 'u', 'want', 'to', 'by', 'a', 'i', 'phone', 'for', 'cheap', 'price', 'go', 'ahead', 'with', 'xr']","['best', 'phone', 'price', 'got', 'worth', 'perform', 'gud', 'heard', 'xr', 'batteri', 'last', 'long', 'phone', 'seriou', 'actual', 'normal', 'phone', 'weight', 'heavi', 'phone', 'osm', 'osm', 'u', 'want', 'phone', 'cheap', 'price', 'go', 'ahead', 'xr']",best phone price got worth perform gud heard xr batteri last long phone seriou actual normal phone weight heavi phone osm osm u want phone cheap price go ahead xr
294,Kuldeep Singh,fair,4,awesome handset camera is great battery backup is nice it works whole day in a single charge only thing that bothers me is the bezels of this phone even after this is a full screen phone i has a very thick bezel on all the sides,"['awesome', 'handset', 'camera', 'is', 'great', 'battery', 'backup', 'is', 'nice', 'it', 'works', 'whole', 'day', 'in', 'a', 'single', 'charge', 'only', 'thing', 'that', 'bothers', 'me', 'is', 'the', 'bezels', 'of', 'this', 'phone', 'even', 'after', 'this', 'is', 'a', 'full', 'screen', 'phone', 'i', 'has', 'a', 'very', 'thick', 'bezel', 'on', 'all', 'the', 'sides']","['awesome', 'handset', 'camera', 'is', 'great', 'battery', 'backup', 'is', 'nice', 'it', 'works', 'whole', 'day', 'in', 'a', 'single', 'charge', 'only', 'thing', 'that', 'bothers', 'me', 'is', 'the', 'bezels', 'of', 'this', 'phone', 'even', 'after', 'this', 'is', 'a', 'full', 'screen', 'phone', 'i', 'has', 'a', 'very', 'thick', 'bezel', 'on', 'all', 'the', 'sides']","['awesom', 'handset', 'camera', 'great', 'batteri', 'backup', 'nice', 'work', 'whole', 'day', 'singl', 'charg', 'thing', 'bother', 'bezel', 'phone', 'even', 'full', 'screen', 'phone', 'thick', 'bezel', 'side']",awesom handset camera great batteri backup nice work whole day singl charg thing bother bezel phone even full screen phone thick bezel side
295,rahul singh,good choice,5,superb and cool product,"['superb', 'and', 'cool', 'product']","['superb', 'and', 'cool', 'product']","['superb', 'cool', 'product']",superb cool product
296,Deepak  Priyadarshi ,terrific purchase,5,my first iphone amazing experience with ios,"['my', 'first', 'iphone', 'amazing', 'experience', 'with', 'ios']","['my', 'first', 'i', 'phone', 'amazing', 'experience', 'with', 'ios']","['first', 'phone', 'amaz', 'experi', 'io']",first phone amaz experi io
297,Ramiz Zaman,mindblowing purchase,5,wonderful phone i dont take much photos so lack of dual cameras doesnt bother meits a beast,"['wonderful', 'phone', 'i', 'dont', 'take', 'much', 'photos', 'so', 'lack', 'of', 'dual', 'cameras', 'doesnt', 'bother', 'meits', 'a', 'beast']","['wonderful', 'phone', 'i', 'dont', 'take', 'much', 'photos', 'so', 'lack', 'of', 'dual', 'cameras', 'doesnt', 'bother', 'me', 'its', 'a', 'beast']","['wonder', 'phone', 'dont', 'take', 'much', 'photo', 'lack', 'dual', 'camera', 'doesnt', 'bother', 'beast']",wonder phone dont take much photo lack dual camera doesnt bother beast
298,Gaurav Joshi,classy product,5,nice,['nice'],['nice'],['nice'],nice
299,sukhi bhullar,excellent,2,awsm product by apple super,"['awsm', 'product', 'by', 'apple', 'super']","['awsm', 'product', 'by', 'apple', 'super']","['awsm', 'product', 'appl', 'super']",awsm product appl super
300,rahul gupta,very poor,5,very bad experience ,"['very', 'bad', 'experience']","['very', 'bad', 'experience']","['bad', 'experi']",bad experi
301,Vinod Choudhary,classy product,5,very nice superb product,"['very', 'nice', 'superb', 'product']","['very', 'nice', 'superb', 'product']","['nice', 'superb', 'product']",nice superb product
302,satyam nagpal,best in the market,5,great phonesurely better then last year’s iphoneand better value thanmore,"['great', 'phonesurely', 'better', 'then', 'last', 'year', '’', 's', 'iphoneand', 'better', 'value', 'thanmore']","['great', 'phone', 'surely', 'better', 'then', 'last', 'year', 's', 'i', 'phone', 'and', 'better', 'value', 'than', 'more']","['great', 'phone', 'sure', 'better', 'last', 'year', 'phone', 'better', 'valu']",great phone sure better last year phone better valu
303,Sukru Swain,best in the market,5,undoubtedly ios is the best,"['undoubtedly', 'ios', 'is', 'the', 'best']","['undoubtedly', 'ios', 'is', 'the', 'best']","['undoubtedli', 'io', 'best']",undoubtedli io best
304,Sudharshan  Eabi ,great product,5,this is myexperience with iphone i never expect this kind of performance and thus is the best mobile i’ll ever usedvalue for money,"['this', 'is', 'myexperience', 'with', 'iphone', 'i', 'never', 'expect', 'this', 'kind', 'of', 'performance', 'and', 'thus', 'is', 'the', 'best', 'mobile', 'i', '’', 'll', 'ever', 'usedvalue', 'for', 'money']","['this', 'is', 'my', 'experience', 'with', 'i', 'phone', 'i', 'never', 'expect', 'this', 'kind', 'of', 'performance', 'and', 'thus', 'is', 'the', 'best', 'mobile', 'i', 'll', 'ever', 'used', 'value', 'for', 'money']","['experi', 'phone', 'never', 'expect', 'kind', 'perform', 'thu', 'best', 'mobil', 'ever', 'use', 'valu', 'money']",experi phone never expect kind perform thu best mobil ever use valu money
305,Abhijeet,must buy,5,best phone ever i brought,"['best', 'phone', 'ever', 'i', 'brought']","['best', 'phone', 'ever', 'i', 'brought']","['best', 'phone', 'ever', 'brought']",best phone ever brought
306,Shreekara  Hs,fabulous,5,awesome phone from apple,"['awesome', 'phone', 'from', 'apple']","['awesome', 'phone', 'from', 'apple']","['awesom', 'phone', 'appl']",awesom phone appl
307,Flipkart Customer,highly recommended,5,nice moblie,"['nice', 'moblie']","['nice', 'moblie']","['nice', 'mobli']",nice mobli
308,subho dey,terrific,5,nice phone,"['nice', 'phone']","['nice', 'phone']","['nice', 'phone']",nice phone
309,HIMANSHU BHATT,wonderful,1,just buy in outstanding performancesome peoples think wide notches makes phone odd just do a trial seriously top class performance premium quality phone,"['just', 'buy', 'in', 'outstanding', 'performancesome', 'peoples', 'think', 'wide', 'notches', 'makes', 'phone', 'odd', 'just', 'do', 'a', 'trial', 'seriously', 'top', 'class', 'performance', 'premium', 'quality', 'phone']","['just', 'buy', 'in', 'outstanding', 'performance', 'some', 'peoples', 'think', 'wide', 'notches', 'makes', 'phone', 'odd', 'just', 'do', 'a', 'trial', 'seriously', 'top', 'class', 'performance', 'premium', 'quality', 'phone']","['buy', 'outstand', 'perform', 'peopl', 'think', 'wide', 'notch', 'make', 'phone', 'odd', 'trial', 'serious', 'top', 'class', 'perform', 'premium', 'qualiti', 'phone']",buy outstand perform peopl think wide notch make phone odd trial serious top class perform premium qualiti phone
310,Flipkart Customer,perfect product,5,best iphone,"['best', 'iphone']","['best', 'i', 'phone']","['best', 'phone']",best phone
311,Fesal  Khan,must buy,5,awesome,['awesome'],['awesome'],['awesom'],awesom
312,Suresh kumar,great product,5,nice productcamera quality is goodits very awesomeits very nice performance,"['nice', 'productcamera', 'quality', 'is', 'goodits', 'very', 'awesomeits', 'very', 'nice', 'performance']","['nice', 'product', 'camera', 'quality', 'is', 'good', 'its', 'very', 'awesome', 'its', 'very', 'nice', 'performance']","['nice', 'product', 'camera', 'qualiti', 'good', 'awesom', 'nice', 'perform']",nice product camera qualiti good awesom nice perform
313,Harsh Dugtal,simply awesome,5,the best iphone to get inif you don’t unnecessarily want multiple cameras i have used the iphonepreviously and honestly i don’t feel like i’m missing out on anything using the xr currently,"['the', 'best', 'iphone', 'to', 'get', 'inif', 'you', 'don', '’', 't', 'unnecessarily', 'want', 'multiple', 'cameras', 'i', 'have', 'used', 'the', 'iphonepreviously', 'and', 'honestly', 'i', 'don', '’', 't', 'feel', 'like', 'i', '’', 'm', 'missing', 'out', 'on', 'anything', 'using', 'the', 'xr', 'currently']","['the', 'best', 'i', 'phone', 'to', 'get', 'in', 'if', 'you', 'don', 't', 'unnecessarily', 'want', 'multiple', 'cameras', 'i', 'have', 'used', 'the', 'i', 'phone', 'previously', 'and', 'honestly', 'i', 'don', 't', 'feel', 'like', 'i', 'm', 'missing', 'out', 'on', 'anything', 'using', 'the', 'xr', 'currently']","['best', 'phone', 'get', 'unnecessarili', 'want', 'multipl', 'camera', 'use', 'phone', 'previous', 'honestli', 'feel', 'like', 'miss', 'anyth', 'use', 'xr', 'current']",best phone get unnecessarili want multipl camera use phone previous honestli feel like miss anyth use xr current
314,Saurabh .,just wow,5,upgrade from android just one word awesomeno phone can beat iphone got amazing deal get this inmore,"['upgrade', 'from', 'android', 'just', 'one', 'word', 'awesomeno', 'phone', 'can', 'beat', 'iphone', 'got', 'amazing', 'deal', 'get', 'this', 'inmore']","['upgrade', 'from', 'android', 'just', 'one', 'word', 'awesome', 'no', 'phone', 'can', 'beat', 'i', 'phone', 'got', 'amazing', 'deal', 'get', 'this', 'in', 'more']","['upgrad', 'android', 'one', 'word', 'awesom', 'phone', 'beat', 'phone', 'got', 'amaz', 'deal', 'get']",upgrad android one word awesom phone beat phone got amaz deal get
315,Flipkart Customer,good quality product,4,phone works properly a star less for taking so much time for delivery,"['phone', 'works', 'properly', 'a', 'star', 'less', 'for', 'taking', 'so', 'much', 'time', 'for', 'delivery']","['phone', 'works', 'properly', 'a', 'star', 'less', 'for', 'taking', 'so', 'much', 'time', 'for', 'delivery']","['phone', 'work', 'properli', 'star', 'less', 'take', 'much', 'time', 'deliveri']",phone work properli star less take much time deliveri
316,Suraj Mondal,simply awesome,5,excellent super fastgot it formore,"['excellent', 'super', 'fastgot', 'it', 'formore']","['excellent', 'super', 'fast', 'got', 'it', 'for', 'more']","['excel', 'super', 'fast', 'got']",excel super fast got
317,Madhan Kumar,super,5,really awsome no words to say only one word iphone ,"['really', 'awsome', 'no', 'words', 'to', 'say', 'only', 'one', 'word', 'iphone']","['really', 'awsome', 'no', 'words', 'to', 'say', 'only', 'one', 'word', 'i', 'phone']","['realli', 'awsom', 'word', 'say', 'one', 'word', 'phone']",realli awsom word say one word phone
318,Tanveer  Ali khan (monu),highly recommended,5,amzing phone juss wroth it,"['amzing', 'phone', 'juss', 'wroth', 'it']","['amzing', 'phone', 'juss', 'wroth', 'it']","['amz', 'phone', 'juss', 'wroth']",amz phone juss wroth
319,Flipkart Customer,highly recommended,5,best cell phone in the market must buy,"['best', 'cell', 'phone', 'in', 'the', 'market', 'must', 'buy']","['best', 'cell', 'phone', 'in', 'the', 'market', 'must', 'buy']","['best', 'cell', 'phone', 'market', 'must', 'buy']",best cell phone market must buy
320,Pinku Laskar,brilliant,5,best experience for use,"['best', 'experience', 'for', 'use']","['best', 'experience', 'for', 'use']","['best', 'experi', 'use']",best experi use
321,Rabikumar D V,satisfied with service and product delivery,4,received on time with good condition,"['received', 'on', 'time', 'with', 'good', 'condition']","['received', 'on', 'time', 'with', 'good', 'condition']","['receiv', 'time', 'good', 'condit']",receiv time good condit
322,Biswajit  Maity,great product,5,awasome phone performance excellent mind blowing purchase,"['awasome', 'phone', 'performance', 'excellent', 'mind', 'blowing', 'purchase']","['awa', 'some', 'phone', 'performance', 'excellent', 'mind', 'blowing', 'purchase']","['awa', 'phone', 'perform', 'excel', 'mind', 'blow', 'purchas']",awa phone perform excel mind blow purchas
323,Flipkart Customer,worth every penny,5,nice and apple first experience its nice to use and camera is very clearcamera,"['nice', 'and', 'apple', 'first', 'experience', 'its', 'nice', 'to', 'use', 'and', 'camera', 'is', 'very', 'clearcamera']","['nice', 'and', 'apple', 'first', 'experience', 'its', 'nice', 'to', 'use', 'and', 'camera', 'is', 'very', 'clear', 'camera']","['nice', 'appl', 'first', 'experi', 'nice', 'use', 'camera', 'clear', 'camera']",nice appl first experi nice use camera clear camera
324,Flipkart Customer,highly recommended,5,a great phone dont choose se choose xr,"['a', 'great', 'phone', 'dont', 'choose', 'se', 'choose', 'xr']","['a', 'great', 'phone', 'dont', 'choose', 'se', 'choose', 'xr']","['great', 'phone', 'dont', 'choos', 'se', 'choos', 'xr']",great phone dont choos se choos xr
325,Abinasha Sahoo,awesome,5,value for money,"['value', 'for', 'money']","['value', 'for', 'money']","['valu', 'money']",valu money
326,Ashutosh kumar Bhakat,best in the market,5,value for money,"['value', 'for', 'money']","['value', 'for', 'money']","['valu', 'money']",valu money
327,Flipkart Customer,awesome,5,awesome phone thanks flipkart for fast delivery,"['awesome', 'phone', 'thanks', 'flipkart', 'for', 'fast', 'delivery']","['awesome', 'phone', 'thanks', 'flip', 'kart', 'for', 'fast', 'delivery']","['awesom', 'phone', 'thank', 'flip', 'kart', 'fast', 'deliveri']",awesom phone thank flip kart fast deliveri
328,Shivam tickoo,terrific,5,this is a beast in every features believe me,"['this', 'is', 'a', 'beast', 'in', 'every', 'features', 'believe', 'me']","['this', 'is', 'a', 'beast', 'in', 'every', 'features', 'believe', 'me']","['beast', 'everi', 'featur', 'believ']",beast everi featur believ
329,Rishu  jaiswal,perfect product,5,very nyc xr i think its better then se battery life is osm and also its performance is to good ,"['very', 'nyc', 'xr', 'i', 'think', 'its', 'better', 'then', 'se', 'battery', 'life', 'is', 'osm', 'and', 'also', 'its', 'performance', 'is', 'to', 'good']","['very', 'nyc', 'xr', 'i', 'think', 'its', 'better', 'then', 'se', 'battery', 'life', 'is', 'osm', 'and', 'also', 'its', 'performance', 'is', 'to', 'good']","['nyc', 'xr', 'think', 'better', 'se', 'batteri', 'life', 'osm', 'also', 'perform', 'good']",nyc xr think better se batteri life osm also perform good
330,Surabhi K,brilliant,5,good product,"['good', 'product']","['good', 'product']","['good', 'product']",good product
331,Flipkart Customer,best in the market,5,cool,['cool'],['cool'],['cool'],cool
332,AFAK AHMED BAGWAN,terrific,5,no doubtowesome phone ,"['no', 'doubtowesome', 'phone']","['no', 'doubt', 'owe', 'some', 'phone']","['doubt', 'owe', 'phone']",doubt owe phone
333,Shahnawaz Rayeen,really nice,4,awesome performance value for money,"['awesome', 'performance', 'value', 'for', 'money']","['awesome', 'performance', 'value', 'for', 'money']","['awesom', 'perform', 'valu', 'money']",awesom perform valu money
334,Vijay Yadav,wonderful,5,it has been an amazing experience switched from a pixeland definitely feels like a solid upgrade,"['it', 'has', 'been', 'an', 'amazing', 'experience', 'switched', 'from', 'a', 'pixeland', 'definitely', 'feels', 'like', 'a', 'solid', 'upgrade']","['it', 'has', 'been', 'an', 'amazing', 'experience', 'switched', 'from', 'a', 'pixel', 'and', 'definitely', 'feels', 'like', 'a', 'solid', 'upgrade']","['amaz', 'experi', 'switch', 'pixel', 'definit', 'feel', 'like', 'solid', 'upgrad']",amaz experi switch pixel definit feel like solid upgrad
335,Flipkart Customer,worth every penny,5,good phone,"['good', 'phone']","['good', 'phone']","['good', 'phone']",good phone
