,User Name,Heading,Rating,Review,tokens,tokens_seg,tokens_stem,review1
125,DILEEP KUMAR SHAH,valueformoney,4,everything is perfectly fine except the display quality and night mode in camera if there was a amoled display in it and night shot capability nothing could have been bettersnuggly performance and butter like smoothness are simply the identity of ios,"['everything', 'is', 'perfectly', 'fine', 'except', 'the', 'display', 'quality', 'and', 'night', 'mode', 'in', 'camera', 'if', 'there', 'was', 'a', 'amoled', 'display', 'in', 'it', 'and', 'night', 'shot', 'capability', 'nothing', 'could', 'have', 'been', 'bettersnuggly', 'performance', 'and', 'butter', 'like', 'smoothness', 'are', 'simply', 'the', 'identity', 'of', 'ios']","['everything', 'is', 'perfectly', 'fine', 'except', 'the', 'display', 'quality', 'and', 'night', 'mode', 'in', 'camera', 'if', 'there', 'was', 'a', 'am', 'oled', 'display', 'in', 'it', 'and', 'night', 'shot', 'capability', 'nothing', 'could', 'have', 'been', 'better', 'snuggly', 'performance', 'and', 'butter', 'like', 'smoothness', 'are', 'simply', 'the', 'identity', 'of', 'ios']","['everyth', 'perfectli', 'fine', 'except', 'display', 'qualiti', 'night', 'mode', 'camera', 'ole', 'display', 'night', 'shot', 'capabl', 'noth', 'could', 'better', 'snuggli', 'perform', 'butter', 'like', 'smooth', 'simpli', 'ident', 'io']",everyth perfectli fine except display qualiti night mode camera ole display night shot capabl noth could better snuggli perform butter like smooth simpli ident io
126,Flipkart Customer,highly recommended,5,i upgradedto i phone xr mobile performance is superb goodbut in flipkart while we are pursuing its showingdays guarantee but there is no return the product after purchasedday the mobile price dropped tofeeling bad,"['i', 'upgradedto', 'i', 'phone', 'xr', 'mobile', 'performance', 'is', 'superb', 'goodbut', 'in', 'flipkart', 'while', 'we', 'are', 'pursuing', 'its', 'showingdays', 'guarantee', 'but', 'there', 'is', 'no', 'return', 'the', 'product', 'after', 'purchasedday', 'the', 'mobile', 'price', 'dropped', 'tofeeling', 'bad']","['i', 'upgraded', 'to', 'i', 'phone', 'xr', 'mobile', 'performance', 'is', 'superb', 'good', 'but', 'in', 'flip', 'kart', 'while', 'we', 'are', 'pursuing', 'its', 'showing', 'days', 'guarantee', 'but', 'there', 'is', 'no', 'return', 'the', 'product', 'after', 'purchased', 'day', 'the', 'mobile', 'price', 'dropped', 'to', 'feeling', 'bad']","['upgrad', 'phone', 'xr', 'mobil', 'perform', 'superb', 'good', 'flip', 'kart', 'pursu', 'show', 'day', 'guarante', 'return', 'product', 'purchas', 'day', 'mobil', 'price', 'drop', 'feel', 'bad']",upgrad phone xr mobil perform superb good flip kart pursu show day guarante return product purchas day mobil price drop feel bad
127,rajendra varma pericherla,terrific purchase,5,very much satisfied with the flipkart deliverygot it forin big billion day sale coming toperformance is mindis very efficient though thanks to thetech mind the on paper specs of displaythe display is crispy enough and supremely colour accuratedont compare with amoled and sufficient brightness even in brightquality is awesome in this device both from earpods and stereo built inno need to say,"['very', 'much', 'satisfied', 'with', 'the', 'flipkart', 'deliverygot', 'it', 'forin', 'big', 'billion', 'day', 'sale', 'coming', 'toperformance', 'is', 'mindis', 'very', 'efficient', 'though', 'thanks', 'to', 'thetech', 'mind', 'the', 'on', 'paper', 'specs', 'of', 'displaythe', 'display', 'is', 'crispy', 'enough', 'and', 'supremely', 'colour', 'accuratedont', 'compare', 'with', 'amoled', 'and', 'sufficient', 'brightness', 'even', 'in', 'brightquality', 'is', 'awesome', 'in', 'this', 'device', 'both', 'from', 'earpods', 'and', 'stereo', 'built', 'inno', 'need', 'to', 'say']","['very', 'much', 'satisfied', 'with', 'the', 'flip', 'kart', 'delivery', 'got', 'it', 'for', 'in', 'big', 'billion', 'day', 'sale', 'coming', 'to', 'performance', 'is', 'mind', 'is', 'very', 'efficient', 'though', 'thanks', 'to', 'the', 'tech', 'mind', 'the', 'on', 'paper', 'specs', 'of', 'display', 'the', 'display', 'is', 'crispy', 'enough', 'and', 'supremely', 'colour', 'accurate', 'dont', 'compare', 'with', 'am', 'oled', 'and', 'sufficient', 'brightness', 'even', 'in', 'bright', 'quality', 'is', 'awesome', 'in', 'this', 'device', 'both', 'from', 'ear', 'pods', 'and', 'stereo', 'built', 'in', 'no', 'need', 'to', 'say']","['much', 'satisfi', 'flip', 'kart', 'deliveri', 'got', 'big', 'billion', 'day', 'sale', 'come', 'perform', 'mind', 'effici', 'though', 'thank', 'tech', 'mind', 'paper', 'spec', 'display', 'display', 'crispi', 'enough', 'suprem', 'colour', 'accur', 'dont', 'compar', 'ole', 'suffici', 'bright', 'even', 'bright', 'qualiti', 'awesom', 'devic', 'ear', 'pod', 'stereo', 'built', 'need', 'say']",much satisfi flip kart deliveri got big billion day sale come perform mind effici though thank tech mind paper spec display display crispi enough suprem colour accur dont compar ole suffici bright even bright qualiti awesom devic ear pod stereo built need say
128,Nandu  S,great product,5,fabulous devicethis is my first iphone and i’m in love with it already good service from flipkart got it just after one and a half days after ordering,"['fabulous', 'devicethis', 'is', 'my', 'first', 'iphone', 'and', 'i', '’', 'm', 'in', 'love', 'with', 'it', 'already', 'good', 'service', 'from', 'flipkart', 'got', 'it', 'just', 'after', 'one', 'and', 'a', 'half', 'days', 'after', 'ordering']","['fabulous', 'device', 'this', 'is', 'my', 'first', 'i', 'phone', 'and', 'i', 'm', 'in', 'love', 'with', 'it', 'already', 'good', 'service', 'from', 'flip', 'kart', 'got', 'it', 'just', 'after', 'one', 'and', 'a', 'half', 'days', 'after', 'ordering']","['fabul', 'devic', 'first', 'phone', 'love', 'alreadi', 'good', 'servic', 'flip', 'kart', 'got', 'one', 'half', 'day', 'order']",fabul devic first phone love alreadi good servic flip kart got one half day order
129,Flipkart Customer,terrific,5,best phone bit heavy but really worth battery life is really good am really satisfied with phone delivery shipment prompt,"['best', 'phone', 'bit', 'heavy', 'but', 'really', 'worth', 'battery', 'life', 'is', 'really', 'good', 'am', 'really', 'satisfied', 'with', 'phone', 'delivery', 'shipment', 'prompt']","['best', 'phone', 'bit', 'heavy', 'but', 'really', 'worth', 'battery', 'life', 'is', 'really', 'good', 'am', 'really', 'satisfied', 'with', 'phone', 'delivery', 'shipment', 'prompt']","['best', 'phone', 'bit', 'heavi', 'realli', 'worth', 'batteri', 'life', 'realli', 'good', 'realli', 'satisfi', 'phone', 'deliveri', 'shipment', 'prompt']",best phone bit heavi realli worth batteri life realli good realli satisfi phone deliveri shipment prompt
130,Prabhu N,just wow,5,good phone and good seller classic awesome red colour,"['good', 'phone', 'and', 'good', 'seller', 'classic', 'awesome', 'red', 'colour']","['good', 'phone', 'and', 'good', 'seller', 'classic', 'awesome', 'red', 'colour']","['good', 'phone', 'good', 'seller', 'classic', 'awesom', 'red', 'colour']",good phone good seller classic awesom red colour
131,Susheel  Dubey,brilliant,5,one of the best mobile battery must be stronger than presentcamera quality is good touching sensors working very good my overall experience is amazingthank you flipkart for youfast delivery service,"['one', 'of', 'the', 'best', 'mobile', 'battery', 'must', 'be', 'stronger', 'than', 'presentcamera', 'quality', 'is', 'good', 'touching', 'sensors', 'working', 'very', 'good', 'my', 'overall', 'experience', 'is', 'amazingthank', 'you', 'flipkart', 'for', 'youfast', 'delivery', 'service']","['one', 'of', 'the', 'best', 'mobile', 'battery', 'must', 'be', 'stronger', 'than', 'present', 'camera', 'quality', 'is', 'good', 'touching', 'sensors', 'working', 'very', 'good', 'my', 'overall', 'experience', 'is', 'amazing', 'thank', 'you', 'flip', 'kart', 'for', 'you', 'fast', 'delivery', 'service']","['one', 'best', 'mobil', 'batteri', 'must', 'stronger', 'present', 'camera', 'qualiti', 'good', 'touch', 'sensor', 'work', 'good', 'overal', 'experi', 'amaz', 'thank', 'flip', 'kart', 'fast', 'deliveri', 'servic']",one best mobil batteri must stronger present camera qualiti good touch sensor work good overal experi amaz thank flip kart fast deliveri servic
132,Biswadeep Pradhan,wonderful,5,superb phone design is very good and very slimsmooth feather touch display and no lag there are some new features but not many differences than iphoneor older models good battery lifewhat i like is touch sensitive is too good and face id is working perfect initially you will miss the home button if you have upgraded from iphonegradually you will be adjusted to the phone and what i find is with out home button phone is great and multitasking also working fine ,"['superb', 'phone', 'design', 'is', 'very', 'good', 'and', 'very', 'slimsmooth', 'feather', 'touch', 'display', 'and', 'no', 'lag', 'there', 'are', 'some', 'new', 'features', 'but', 'not', 'many', 'differences', 'than', 'iphoneor', 'older', 'models', 'good', 'battery', 'lifewhat', 'i', 'like', 'is', 'touch', 'sensitive', 'is', 'too', 'good', 'and', 'face', 'id', 'is', 'working', 'perfect', 'initially', 'you', 'will', 'miss', 'the', 'home', 'button', 'if', 'you', 'have', 'upgraded', 'from', 'iphonegradually', 'you', 'will', 'be', 'adjusted', 'to', 'the', 'phone', 'and', 'what', 'i', 'find', 'is', 'with', 'out', 'home', 'button', 'phone', 'is', 'great', 'and', 'multitasking', 'also', 'working', 'fine']","['superb', 'phone', 'design', 'is', 'very', 'good', 'and', 'very', 'slim', 'smooth', 'feather', 'touch', 'display', 'and', 'no', 'lag', 'there', 'are', 'some', 'new', 'features', 'but', 'not', 'many', 'differences', 'than', 'i', 'phone', 'or', 'older', 'models', 'good', 'battery', 'life', 'what', 'i', 'like', 'is', 'touch', 'sensitive', 'is', 'too', 'good', 'and', 'face', 'id', 'is', 'working', 'perfect', 'initially', 'you', 'will', 'miss', 'the', 'home', 'button', 'if', 'you', 'have', 'upgraded', 'from', 'i', 'phone', 'gradually', 'you', 'will', 'be', 'adjusted', 'to', 'the', 'phone', 'and', 'what', 'i', 'find', 'is', 'with', 'out', 'home', 'button', 'phone', 'is', 'great', 'and', 'multitasking', 'also', 'working', 'fine']","['superb', 'phone', 'design', 'good', 'slim', 'smooth', 'feather', 'touch', 'display', 'lag', 'new', 'featur', 'not', 'mani', 'differ', 'phone', 'older', 'model', 'good', 'batteri', 'life', 'like', 'touch', 'sensit', 'good', 'face', 'id', 'work', 'perfect', 'initi', 'miss', 'home', 'button', 'upgrad', 'phone', 'gradual', 'adjust', 'phone', 'find', 'home', 'button', 'phone', 'great', 'multitask', 'also', 'work', 'fine']",superb phone design good slim smooth feather touch display lag new featur not mani differ phone older model good batteri life like touch sensit good face id work perfect initi miss home button upgrad phone gradual adjust phone find home button phone great multitask also work fine
133,akash pathak,simply awesome,5,awesome device,"['awesome', 'device']","['awesome', 'device']","['awesom', 'devic']",awesom devic
134,Chetan  Sharma ,perfect product,5,phone is good and excellent but price is so high,"['phone', 'is', 'good', 'and', 'excellent', 'but', 'price', 'is', 'so', 'high']","['phone', 'is', 'good', 'and', 'excellent', 'but', 'price', 'is', 'so', 'high']","['phone', 'good', 'excel', 'price', 'high']",phone good excel price high
135,NABARUN  SASMAL,must buy,5,camera awesome,"['camera', 'awesome']","['camera', 'awesome']","['camera', 'awesom']",camera awesom
136,Pratyashi  Devi ,simply awesome,5,my first iphone feeling good ,"['my', 'first', 'iphone', 'feeling', 'good']","['my', 'first', 'i', 'phone', 'feeling', 'good']","['first', 'phone', 'feel', 'good']",first phone feel good
137,Anjalu Maurya,excellent,5,love the red colour,"['love', 'the', 'red', 'colour']","['love', 'the', 'red', 'colour']","['love', 'red', 'colour']",love red colour
138,Aditya Kumar,simply awesome,5,brilliant ios amazing camera excellent battery life premium experiencebetter than iphone x,"['brilliant', 'ios', 'amazing', 'camera', 'excellent', 'battery', 'life', 'premium', 'experiencebetter', 'than', 'iphone', 'x']","['brilliant', 'ios', 'amazing', 'camera', 'excellent', 'battery', 'life', 'premium', 'experience', 'better', 'than', 'i', 'phone', 'x']","['brilliant', 'io', 'amaz', 'camera', 'excel', 'batteri', 'life', 'premium', 'experi', 'better', 'phone', 'x']",brilliant io amaz camera excel batteri life premium experi better phone x
139,Aswini Kumar,excellent,5,my first iphone im so happy its a complete packagei love it ❤️❤️❤️,"['my', 'first', 'iphone', 'im', 'so', 'happy', 'its', 'a', 'complete', 'packagei', 'love', 'it', '❤️❤️❤️']","['my', 'first', 'i', 'phone', 'im', 'so', 'happy', 'its', 'a', 'complete', 'package', 'i', 'love', 'it']","['first', 'phone', 'im', 'happi', 'complet', 'packag', 'love']",first phone im happi complet packag love
140,Bhushan  Chaudhari ,worth every penny,5,awesomegadgetpowerfull device,"['awesomegadgetpowerfull', 'device']","['awesome', 'gadget', 'powerfull', 'device']","['awesom', 'gadget', 'powerful', 'devic']",awesom gadget powerful devic
141,Sipun Kumar,terrific,5,amazing,['amazing'],['amazing'],['amaz'],amaz
142,Solomon  Raj,must buy,5,appleiphone xr was excellentbrilliant,"['appleiphone', 'xr', 'was', 'excellentbrilliant']","['apple', 'i', 'phone', 'xr', 'was', 'excellent', 'brilliant']","['appl', 'phone', 'xr', 'excel', 'brilliant']",appl phone xr excel brilliant
143,Rishu Kumar,classy product,5,i am very happy to buy this phone,"['i', 'am', 'very', 'happy', 'to', 'buy', 'this', 'phone']","['i', 'am', 'very', 'happy', 'to', 'buy', 'this', 'phone']","['happi', 'buy', 'phone']",happi buy phone
144,Deepak  rao ,super,5,super and genius,"['super', 'and', 'genius']","['super', 'and', 'genius']","['super', 'geniu']",super geniu
145,bhanu varma,terrific,5,switched back to ios afteryears feels so smooth and looks premium purchased this on offer forits performance is beyond expectation great haptics feel totally value for money if you purchase in discount,"['switched', 'back', 'to', 'ios', 'afteryears', 'feels', 'so', 'smooth', 'and', 'looks', 'premium', 'purchased', 'this', 'on', 'offer', 'forits', 'performance', 'is', 'beyond', 'expectation', 'great', 'haptics', 'feel', 'totally', 'value', 'for', 'money', 'if', 'you', 'purchase', 'in', 'discount']","['switched', 'back', 'to', 'ios', 'after', 'years', 'feels', 'so', 'smooth', 'and', 'looks', 'premium', 'purchased', 'this', 'on', 'offer', 'for', 'its', 'performance', 'is', 'beyond', 'expectation', 'great', 'haptics', 'feel', 'totally', 'value', 'for', 'money', 'if', 'you', 'purchase', 'in', 'discount']","['switch', 'back', 'io', 'year', 'feel', 'smooth', 'look', 'premium', 'purchas', 'offer', 'perform', 'beyond', 'expect', 'great', 'haptic', 'feel', 'total', 'valu', 'money', 'purchas', 'discount']",switch back io year feel smooth look premium purchas offer perform beyond expect great haptic feel total valu money purchas discount
146,Flipkart Customer,just wow,5,i got best nd lowest pricefor iphone xrgb,"['i', 'got', 'best', 'nd', 'lowest', 'pricefor', 'iphone', 'xrgb']","['i', 'got', 'best', 'nd', 'lowest', 'price', 'for', 'i', 'phone', 'x', 'rgb']","['got', 'best', 'nd', 'lowest', 'price', 'phone', 'x', 'rgb']",got best nd lowest price phone x rgb
147,Tania Biswas,classy product,5,just awesome,"['just', 'awesome']","['just', 'awesome']",['awesom'],awesom
148,Shekhar Suman,nice,3,nice phone coral,"['nice', 'phone', 'coral']","['nice', 'phone', 'coral']","['nice', 'phone', 'coral']",nice phone coral
149,Akash R,wonderful,5, amazing ,['amazing'],['amazing'],['amaz'],amaz
150,cherry prathipati,simply awesome,5,osm mobile ,"['osm', 'mobile']","['osm', 'mobile']","['osm', 'mobil']",osm mobil
151,Flipkart Customer,very good,4,best mobile go for it blindly,"['best', 'mobile', 'go', 'for', 'it', 'blindly']","['best', 'mobile', 'go', 'for', 'it', 'blindly']","['best', 'mobil', 'go', 'blindli']",best mobil go blindli
152,Krishna Mohan,terrific,5,simply awesome no words to speak,"['simply', 'awesome', 'no', 'words', 'to', 'speak']","['simply', 'awesome', 'no', 'words', 'to', 'speak']","['simpli', 'awesom', 'word', 'speak']",simpli awesom word speak
153,Mousumi  Maity,brilliant,5,awesome ❤️,"['awesome', '❤️']",['awesome'],['awesom'],awesom
154,Mohammed Aslam,classy product,5,woooooowfinally bought a iiiiiiphonethis is myiphone superphone smooth performance battery backup was was awesome camerawith depth control was fantastic feeling soooooo happeeee and statisfied with this model face id was awesometo unlock with in a sec even in the dark worth buy ,"['woooooowfinally', 'bought', 'a', 'iiiiiiphonethis', 'is', 'myiphone', 'superphone', 'smooth', 'performance', 'battery', 'backup', 'was', 'was', 'awesome', 'camerawith', 'depth', 'control', 'was', 'fantastic', 'feeling', 'soooooo', 'happeeee', 'and', 'statisfied', 'with', 'this', 'model', 'face', 'id', 'was', 'awesometo', 'unlock', 'with', 'in', 'a', 'sec', 'even', 'in', 'the', 'dark', 'worth', 'buy']","['woooo', 'oow', 'finally', 'bought', 'a', 'iii', 'iii', 'phone', 'this', 'is', 'my', 'i', 'phone', 'super', 'phone', 'smooth', 'performance', 'battery', 'backup', 'was', 'was', 'awesome', 'camera', 'with', 'depth', 'control', 'was', 'fantastic', 'feeling', 'soooo', 'oo', 'happe', 'eee', 'and', 'statis', 'fied', 'with', 'this', 'model', 'face', 'id', 'was', 'awesome', 'to', 'unlock', 'with', 'in', 'a', 'sec', 'even', 'in', 'the', 'dark', 'worth', 'buy']","['woooo', 'oow', 'final', 'bought', 'iii', 'iii', 'phone', 'phone', 'super', 'phone', 'smooth', 'perform', 'batteri', 'backup', 'awesom', 'camera', 'depth', 'control', 'fantast', 'feel', 'soooo', 'oo', 'happ', 'eee', 'stati', 'fie', 'model', 'face', 'id', 'awesom', 'unlock', 'sec', 'even', 'dark', 'worth', 'buy']",woooo oow final bought iii iii phone phone super phone smooth perform batteri backup awesom camera depth control fantast feel soooo oo happ eee stati fie model face id awesom unlock sec even dark worth buy
155,Deo Ankit,highly recommended,5,awesome,['awesome'],['awesome'],['awesom'],awesom
156,Sumrendra Singh,awesome,5,excellent camera battery and performance ,"['excellent', 'camera', 'battery', 'and', 'performance']","['excellent', 'camera', 'battery', 'and', 'performance']","['excel', 'camera', 'batteri', 'perform']",excel camera batteri perform
157,Flipkart Customer,valueformoney,4,happy to hold and feel iphone xrgrt price offered by flipkartbut am really disappointed to say flipkart ppl make tempting offer for ur old phone with higher exchange valuebut while exchange the delivery guy finds a minute scratchvery negligible colour fade on the bottom of the phone and he demands the remaining amount to be paid else he will returni guess we should keep a new unused phone for exchange which should have no scratches or any thing like itbetter to buy in nearb,"['happy', 'to', 'hold', 'and', 'feel', 'iphone', 'xrgrt', 'price', 'offered', 'by', 'flipkartbut', 'am', 'really', 'disappointed', 'to', 'say', 'flipkart', 'ppl', 'make', 'tempting', 'offer', 'for', 'ur', 'old', 'phone', 'with', 'higher', 'exchange', 'valuebut', 'while', 'exchange', 'the', 'delivery', 'guy', 'finds', 'a', 'minute', 'scratchvery', 'negligible', 'colour', 'fade', 'on', 'the', 'bottom', 'of', 'the', 'phone', 'and', 'he', 'demands', 'the', 'remaining', 'amount', 'to', 'be', 'paid', 'else', 'he', 'will', 'returni', 'guess', 'we', 'should', 'keep', 'a', 'new', 'unused', 'phone', 'for', 'exchange', 'which', 'should', 'have', 'no', 'scratches', 'or', 'any', 'thing', 'like', 'itbetter', 'to', 'buy', 'in', 'nearb']","['happy', 'to', 'hold', 'and', 'feel', 'i', 'phone', 'xr', 'grt', 'price', 'offered', 'by', 'flip', 'kart', 'but', 'am', 'really', 'disappointed', 'to', 'say', 'flip', 'kart', 'ppl', 'make', 'tempting', 'offer', 'for', 'ur', 'old', 'phone', 'with', 'higher', 'exchange', 'value', 'but', 'while', 'exchange', 'the', 'delivery', 'guy', 'finds', 'a', 'minute', 'scratch', 'very', 'negligible', 'colour', 'fade', 'on', 'the', 'bottom', 'of', 'the', 'phone', 'and', 'he', 'demands', 'the', 'remaining', 'amount', 'to', 'be', 'paid', 'else', 'he', 'will', 'return', 'i', 'guess', 'we', 'should', 'keep', 'a', 'new', 'unused', 'phone', 'for', 'exchange', 'which', 'should', 'have', 'no', 'scratches', 'or', 'any', 'thing', 'like', 'it', 'better', 'to', 'buy', 'in', 'near', 'b']","['happi', 'hold', 'feel', 'phone', 'xr', 'grt', 'price', 'offer', 'flip', 'kart', 'realli', 'disappoint', 'say', 'flip', 'kart', 'ppl', 'make', 'tempt', 'offer', 'ur', 'old', 'phone', 'higher', 'exchang', 'valu', 'exchang', 'deliveri', 'guy', 'find', 'minut', 'scratch', 'neglig', 'colour', 'fade', 'bottom', 'phone', 'demand', 'remain', 'amount', 'paid', 'els', 'return', 'guess', 'keep', 'new', 'unus', 'phone', 'exchang', 'scratch', 'thing', 'like', 'better', 'buy', 'near', 'b']",happi hold feel phone xr grt price offer flip kart realli disappoint say flip kart ppl make tempt offer ur old phone higher exchang valu exchang deliveri guy find minut scratch neglig colour fade bottom phone demand remain amount paid els return guess keep new unus phone exchang scratch thing like better buy near b
158,Vignesh V,great product,5,most successful model in apple the good thing is everythingbut inside the box there is no lightning connector tojack,"['most', 'successful', 'model', 'in', 'apple', 'the', 'good', 'thing', 'is', 'everythingbut', 'inside', 'the', 'box', 'there', 'is', 'no', 'lightning', 'connector', 'tojack']","['most', 'successful', 'model', 'in', 'apple', 'the', 'good', 'thing', 'is', 'everything', 'but', 'inside', 'the', 'box', 'there', 'is', 'no', 'lightning', 'connector', 'to', 'jack']","['success', 'model', 'appl', 'good', 'thing', 'everyth', 'insid', 'box', 'lightn', 'connector', 'jack']",success model appl good thing everyth insid box lightn connector jack
159,Ashish Chaudhary,brilliant,5,awesome mobile,"['awesome', 'mobile']","['awesome', 'mobile']","['awesom', 'mobil']",awesom mobil
160,Gunja Praveen,worth the money,4,i love thisnice product,"['i', 'love', 'thisnice', 'product']","['i', 'love', 'this', 'nice', 'product']","['love', 'nice', 'product']",love nice product
161,Gaurave Varshney,wonderful,5,after many purchase of android phone finely i decide to by a iphone i done it and i love it,"['after', 'many', 'purchase', 'of', 'android', 'phone', 'finely', 'i', 'decide', 'to', 'by', 'a', 'iphone', 'i', 'done', 'it', 'and', 'i', 'love', 'it']","['after', 'many', 'purchase', 'of', 'android', 'phone', 'finely', 'i', 'decide', 'to', 'by', 'a', 'i', 'phone', 'i', 'done', 'it', 'and', 'i', 'love', 'it']","['mani', 'purchas', 'android', 'phone', 'fine', 'decid', 'phone', 'done', 'love']",mani purchas android phone fine decid phone done love
162,Sanjay Gulati Musafir,terrific,5,i bought it for my wife she is happy using a brand name luckily i bought redmi notepro within a week and im more than satisfied using that despite the fact i also shifted from iphone,"['i', 'bought', 'it', 'for', 'my', 'wife', 'she', 'is', 'happy', 'using', 'a', 'brand', 'name', 'luckily', 'i', 'bought', 'redmi', 'notepro', 'within', 'a', 'week', 'and', 'im', 'more', 'than', 'satisfied', 'using', 'that', 'despite', 'the', 'fact', 'i', 'also', 'shifted', 'from', 'iphone']","['i', 'bought', 'it', 'for', 'my', 'wife', 'she', 'is', 'happy', 'using', 'a', 'brand', 'name', 'luckily', 'i', 'bought', 'red', 'mi', 'note', 'pro', 'within', 'a', 'week', 'and', 'im', 'more', 'than', 'satisfied', 'using', 'that', 'despite', 'the', 'fact', 'i', 'also', 'shifted', 'from', 'i', 'phone']","['bought', 'wife', 'happi', 'use', 'brand', 'name', 'luckili', 'bought', 'red', 'mi', 'note', 'pro', 'within', 'week', 'im', 'satisfi', 'use', 'despit', 'fact', 'also', 'shift', 'phone']",bought wife happi use brand name luckili bought red mi note pro within week im satisfi use despit fact also shift phone
163,Sagar Dixit ,mindblowing purchase,5,the phone was repackednot satisfied with seller product,"['the', 'phone', 'was', 'repackednot', 'satisfied', 'with', 'seller', 'product']","['the', 'phone', 'was', 'repacked', 'not', 'satisfied', 'with', 'seller', 'product']","['phone', 'repack', 'not', 'satisfi', 'seller', 'product']",phone repack not satisfi seller product
164,Saransh Goswami,awesome,5,excellent deal,"['excellent', 'deal']","['excellent', 'deal']","['excel', 'deal']",excel deal
165,MOHAN SUBRAMANYAM,pretty good,4,battery performance not good otherwise nice mobile ,"['battery', 'performance', 'not', 'good', 'otherwise', 'nice', 'mobile']","['battery', 'performance', 'not', 'good', 'otherwise', 'nice', 'mobile']","['batteri', 'perform', 'not', 'good', 'otherwis', 'nice', 'mobil']",batteri perform not good otherwis nice mobil
