,User Name,Heading,Rating,Review,tokens,tokens_seg,tokens_stem,review1
62,Prabhakaran UVP,fabulous,5,awesome phone from applebest camera quality best screen resolution forget about the pixelsgreat sound outputface recognition will be an awestruck feature in this phoneabove all apple user interface is at its best in xrthank you flipkartapple for delivering this product,"['awesome', 'phone', 'from', 'applebest', 'camera', 'quality', 'best', 'screen', 'resolution', 'forget', 'about', 'the', 'pixelsgreat', 'sound', 'outputface', 'recognition', 'will', 'be', 'an', 'awestruck', 'feature', 'in', 'this', 'phoneabove', 'all', 'apple', 'user', 'interface', 'is', 'at', 'its', 'best', 'in', 'xrthank', 'you', 'flipkartapple', 'for', 'delivering', 'this', 'product']","['awesome', 'phone', 'from', 'apple', 'best', 'camera', 'quality', 'best', 'screen', 'resolution', 'forget', 'about', 'the', 'pixels', 'great', 'sound', 'output', 'face', 'recognition', 'will', 'be', 'an', 'awestruck', 'feature', 'in', 'this', 'phone', 'above', 'all', 'apple', 'user', 'interface', 'is', 'at', 'its', 'best', 'in', 'xr', 'thank', 'you', 'flip', 'kart', 'apple', 'for', 'delivering', 'this', 'product']","['awesom', 'phone', 'appl', 'best', 'camera', 'qualiti', 'best', 'screen', 'resolut', 'forget', 'pixel', 'great', 'sound', 'output', 'face', 'recognit', 'awestruck', 'featur', 'phone', 'appl', 'user', 'interfac', 'best', 'xr', 'thank', 'flip', 'kart', 'appl', 'deliv', 'product']",awesom phone appl best camera qualiti best screen resolut forget pixel great sound output face recognit awestruck featur phone appl user interfac best xr thank flip kart appl deliv product
63,Suraj Mondal,nice product,4,some time there is a network problem price is very high as compared to other phone which is available in market if ur iphone lover the u can go for it it is better then iphone xs,"['some', 'time', 'there', 'is', 'a', 'network', 'problem', 'price', 'is', 'very', 'high', 'as', 'compared', 'to', 'other', 'phone', 'which', 'is', 'available', 'in', 'market', 'if', 'ur', 'iphone', 'lover', 'the', 'u', 'can', 'go', 'for', 'it', 'it', 'is', 'better', 'then', 'iphone', 'xs']","['some', 'time', 'there', 'is', 'a', 'network', 'problem', 'price', 'is', 'very', 'high', 'as', 'compared', 'to', 'other', 'phone', 'which', 'is', 'available', 'in', 'market', 'if', 'ur', 'i', 'phone', 'lover', 'the', 'u', 'can', 'go', 'for', 'it', 'it', 'is', 'better', 'then', 'i', 'phone', 'xs']","['time', 'network', 'problem', 'price', 'high', 'compar', 'phone', 'avail', 'market', 'ur', 'phone', 'lover', 'u', 'go', 'better', 'phone', 'xs']",time network problem price high compar phone avail market ur phone lover u go better phone xs
64,Cherian Joseph,perfect product,5,one the best iphone out market trust me the display is one of the best with most accurate colour reproduction in terms of speed its like a monster with excellent battery life which can last upto a day and a half for a moderate to heavy use,"['one', 'the', 'best', 'iphone', 'out', 'market', 'trust', 'me', 'the', 'display', 'is', 'one', 'of', 'the', 'best', 'with', 'most', 'accurate', 'colour', 'reproduction', 'in', 'terms', 'of', 'speed', 'its', 'like', 'a', 'monster', 'with', 'excellent', 'battery', 'life', 'which', 'can', 'last', 'upto', 'a', 'day', 'and', 'a', 'half', 'for', 'a', 'moderate', 'to', 'heavy', 'use']","['one', 'the', 'best', 'i', 'phone', 'out', 'market', 'trust', 'me', 'the', 'display', 'is', 'one', 'of', 'the', 'best', 'with', 'most', 'accurate', 'colour', 'reproduction', 'in', 'terms', 'of', 'speed', 'its', 'like', 'a', 'monster', 'with', 'excellent', 'battery', 'life', 'which', 'can', 'last', 'up', 'to', 'a', 'day', 'and', 'a', 'half', 'for', 'a', 'moderate', 'to', 'heavy', 'use']","['one', 'best', 'phone', 'market', 'trust', 'display', 'one', 'best', 'accur', 'colour', 'reproduct', 'term', 'speed', 'like', 'monster', 'excel', 'batteri', 'life', 'last', 'day', 'half', 'moder', 'heavi', 'use']",one best phone market trust display one best accur colour reproduct term speed like monster excel batteri life last day half moder heavi use
65,S Ranjithkumar,really nice,4,phone is good for the first time user of iphone but not for the other iphone user who thinks its latest version compared tothis will be degraded version of applei donno y this one is not even a full hd display its lukg lyk belowandroid phones display notouch is tolerable bcaz i wont use ofter upgraded were processor which is a sec faster than a previous nd camera even single portrait was fabulous but viewing that image in this display was lukg bit bad if we transfer that,"['phone', 'is', 'good', 'for', 'the', 'first', 'time', 'user', 'of', 'iphone', 'but', 'not', 'for', 'the', 'other', 'iphone', 'user', 'who', 'thinks', 'its', 'latest', 'version', 'compared', 'tothis', 'will', 'be', 'degraded', 'version', 'of', 'applei', 'donno', 'y', 'this', 'one', 'is', 'not', 'even', 'a', 'full', 'hd', 'display', 'its', 'lukg', 'lyk', 'belowandroid', 'phones', 'display', 'notouch', 'is', 'tolerable', 'bcaz', 'i', 'wont', 'use', 'ofter', 'upgraded', 'were', 'processor', 'which', 'is', 'a', 'sec', 'faster', 'than', 'a', 'previous', 'nd', 'camera', 'even', 'single', 'portrait', 'was', 'fabulous', 'but', 'viewing', 'that', 'image', 'in', 'this', 'display', 'was', 'lukg', 'bit', 'bad', 'if', 'we', 'transfer', 'that']","['phone', 'is', 'good', 'for', 'the', 'first', 'time', 'user', 'of', 'i', 'phone', 'but', 'not', 'for', 'the', 'other', 'i', 'phone', 'user', 'who', 'thinks', 'its', 'latest', 'version', 'compared', 'to', 'this', 'will', 'be', 'degraded', 'version', 'of', 'apple', 'i', 'donno', 'y', 'this', 'one', 'is', 'not', 'even', 'a', 'full', 'hd', 'display', 'its', 'lu', 'kg', 'lyk', 'below', 'android', 'phones', 'display', 'no', 'touch', 'is', 'tolerable', 'bc', 'az', 'i', 'wont', 'use', 'of', 'ter', 'upgraded', 'were', 'processor', 'which', 'is', 'a', 'sec', 'faster', 'than', 'a', 'previous', 'nd', 'camera', 'even', 'single', 'portrait', 'was', 'fabulous', 'but', 'viewing', 'that', 'image', 'in', 'this', 'display', 'was', 'lu', 'kg', 'bit', 'bad', 'if', 'we', 'transfer', 'that']","['phone', 'good', 'first', 'time', 'user', 'phone', 'not', 'phone', 'user', 'think', 'latest', 'version', 'compar', 'degrad', 'version', 'appl', 'donno', 'one', 'not', 'even', 'full', 'hd', 'display', 'lu', 'kg', 'lyk', 'android', 'phone', 'display', 'touch', 'toler', 'bc', 'az', 'wont', 'use', 'ter', 'upgrad', 'processor', 'sec', 'faster', 'previou', 'nd', 'camera', 'even', 'singl', 'portrait', 'fabul', 'view', 'imag', 'display', 'lu', 'kg', 'bit', 'bad', 'transfer']",phone good first time user phone not phone user think latest version compar degrad version appl donno one not even full hd display lu kg lyk android phone display touch toler bc az wont use ter upgrad processor sec faster previou nd camera even singl portrait fabul view imag display lu kg bit bad transfer
66,K.P. PRADEEP,highly recommended,5,awesome phone as apple always rocks and flipkart super fast delivery made my day phone is superb no lags and battery backup is also superb i suggest to buy although price is slightly higher but it is ok when u strat using this phone,"['awesome', 'phone', 'as', 'apple', 'always', 'rocks', 'and', 'flipkart', 'super', 'fast', 'delivery', 'made', 'my', 'day', 'phone', 'is', 'superb', 'no', 'lags', 'and', 'battery', 'backup', 'is', 'also', 'superb', 'i', 'suggest', 'to', 'buy', 'although', 'price', 'is', 'slightly', 'higher', 'but', 'it', 'is', 'ok', 'when', 'u', 'strat', 'using', 'this', 'phone']","['awesome', 'phone', 'as', 'apple', 'always', 'rocks', 'and', 'flip', 'kart', 'super', 'fast', 'delivery', 'made', 'my', 'day', 'phone', 'is', 'superb', 'no', 'lags', 'and', 'battery', 'backup', 'is', 'also', 'superb', 'i', 'suggest', 'to', 'buy', 'although', 'price', 'is', 'slightly', 'higher', 'but', 'it', 'is', 'ok', 'when', 'u', 'strat', 'using', 'this', 'phone']","['awesom', 'phone', 'appl', 'alway', 'rock', 'flip', 'kart', 'super', 'fast', 'deliveri', 'made', 'day', 'phone', 'superb', 'lag', 'batteri', 'backup', 'also', 'superb', 'suggest', 'buy', 'although', 'price', 'slightli', 'higher', 'ok', 'u', 'strat', 'use', 'phone']",awesom phone appl alway rock flip kart super fast deliveri made day phone superb lag batteri backup also superb suggest buy although price slightli higher ok u strat use phone
67,Flipkart Customer,nice product,4,good phone not bad felt happy on purchasing with flipkart but to get this product for me it takesdays to get from the ekart logistics please be quick with process intimate customer in a proper way of shipping goodscamera more,"['good', 'phone', 'not', 'bad', 'felt', 'happy', 'on', 'purchasing', 'with', 'flipkart', 'but', 'to', 'get', 'this', 'product', 'for', 'me', 'it', 'takesdays', 'to', 'get', 'from', 'the', 'ekart', 'logistics', 'please', 'be', 'quick', 'with', 'process', 'intimate', 'customer', 'in', 'a', 'proper', 'way', 'of', 'shipping', 'goodscamera', 'more']","['good', 'phone', 'not', 'bad', 'felt', 'happy', 'on', 'purchasing', 'with', 'flip', 'kart', 'but', 'to', 'get', 'this', 'product', 'for', 'me', 'it', 'takes', 'days', 'to', 'get', 'from', 'the', 'e', 'kart', 'logistics', 'please', 'be', 'quick', 'with', 'process', 'intimate', 'customer', 'in', 'a', 'proper', 'way', 'of', 'shipping', 'goods', 'camera', 'more']","['good', 'phone', 'not', 'bad', 'felt', 'happi', 'purchas', 'flip', 'kart', 'get', 'product', 'take', 'day', 'get', 'e', 'kart', 'logist', 'pleas', 'quick', 'process', 'intim', 'custom', 'proper', 'way', 'ship', 'good', 'camera']",good phone not bad felt happi purchas flip kart get product take day get e kart logist pleas quick process intim custom proper way ship good camera
68,Sujay V,classy product,5,first of all thanks to flipkart for giving a very good productyears use of android now i m shifted from android to ios regarding product iphone xr is best and value for money compared to android use of ios is awesome but firstdays you will face some difficulty how to download apps how to use all apps once you aware about ios you will never think of androidfriends phone is very fastbattery and display also very good why i didnt know some people are telling display is not good,"['first', 'of', 'all', 'thanks', 'to', 'flipkart', 'for', 'giving', 'a', 'very', 'good', 'productyears', 'use', 'of', 'android', 'now', 'i', 'm', 'shifted', 'from', 'android', 'to', 'ios', 'regarding', 'product', 'iphone', 'xr', 'is', 'best', 'and', 'value', 'for', 'money', 'compared', 'to', 'android', 'use', 'of', 'ios', 'is', 'awesome', 'but', 'firstdays', 'you', 'will', 'face', 'some', 'difficulty', 'how', 'to', 'download', 'apps', 'how', 'to', 'use', 'all', 'apps', 'once', 'you', 'aware', 'about', 'ios', 'you', 'will', 'never', 'think', 'of', 'androidfriends', 'phone', 'is', 'very', 'fastbattery', 'and', 'display', 'also', 'very', 'good', 'why', 'i', 'didnt', 'know', 'some', 'people', 'are', 'telling', 'display', 'is', 'not', 'good']","['first', 'of', 'all', 'thanks', 'to', 'flip', 'kart', 'for', 'giving', 'a', 'very', 'good', 'product', 'years', 'use', 'of', 'android', 'now', 'i', 'm', 'shifted', 'from', 'android', 'to', 'ios', 'regarding', 'product', 'i', 'phone', 'xr', 'is', 'best', 'and', 'value', 'for', 'money', 'compared', 'to', 'android', 'use', 'of', 'ios', 'is', 'awesome', 'but', 'first', 'days', 'you', 'will', 'face', 'some', 'difficulty', 'how', 'to', 'download', 'apps', 'how', 'to', 'use', 'all', 'apps', 'once', 'you', 'aware', 'about', 'ios', 'you', 'will', 'never', 'think', 'of', 'android', 'friends', 'phone', 'is', 'very', 'fast', 'battery', 'and', 'display', 'also', 'very', 'good', 'why', 'i', 'didnt', 'know', 'some', 'people', 'are', 'telling', 'display', 'is', 'not', 'good']","['first', 'thank', 'flip', 'kart', 'give', 'good', 'product', 'year', 'use', 'android', 'shift', 'android', 'io', 'regard', 'product', 'phone', 'xr', 'best', 'valu', 'money', 'compar', 'android', 'use', 'io', 'awesom', 'first', 'day', 'face', 'difficulti', 'download', 'app', 'use', 'app', 'awar', 'io', 'never', 'think', 'android', 'friend', 'phone', 'fast', 'batteri', 'display', 'also', 'good', 'didnt', 'know', 'peopl', 'tell', 'display', 'not', 'good']",first thank flip kart give good product year use android shift android io regard product phone xr best valu money compar android use io awesom first day face difficulti download app use app awar io never think android friend phone fast batteri display also good didnt know peopl tell display not good
69,Shivam Das,best in the market,5,the best iphone ive ever usedthe best value for money atu have hdfc cardthen atunbeatableaaha if u are up for the displaythen onepluswould be best at this price but if u dont care about the display but if u are looking for long term flawless usagethe best one is here which u see above personally kinda love it because of its designand form factor and yaa build quality obviously and easy for one hand useand performance u know it damn goodand,"['the', 'best', 'iphone', 'ive', 'ever', 'usedthe', 'best', 'value', 'for', 'money', 'atu', 'have', 'hdfc', 'cardthen', 'atunbeatableaaha', 'if', 'u', 'are', 'up', 'for', 'the', 'displaythen', 'onepluswould', 'be', 'best', 'at', 'this', 'price', 'but', 'if', 'u', 'dont', 'care', 'about', 'the', 'display', 'but', 'if', 'u', 'are', 'looking', 'for', 'long', 'term', 'flawless', 'usagethe', 'best', 'one', 'is', 'here', 'which', 'u', 'see', 'above', 'personally', 'kinda', 'love', 'it', 'because', 'of', 'its', 'designand', 'form', 'factor', 'and', 'yaa', 'build', 'quality', 'obviously', 'and', 'easy', 'for', 'one', 'hand', 'useand', 'performance', 'u', 'know', 'it', 'damn', 'goodand']","['the', 'best', 'i', 'phone', 'ive', 'ever', 'used', 'the', 'best', 'value', 'for', 'money', 'at', 'u', 'have', 'hdfc', 'card', 'then', 'at', 'unbeatable', 'aaha', 'if', 'u', 'are', 'up', 'for', 'the', 'display', 'then', 'one', 'plus', 'would', 'be', 'best', 'at', 'this', 'price', 'but', 'if', 'u', 'dont', 'care', 'about', 'the', 'display', 'but', 'if', 'u', 'are', 'looking', 'for', 'long', 'term', 'flawless', 'usage', 'the', 'best', 'one', 'is', 'here', 'which', 'u', 'see', 'above', 'personally', 'kinda', 'love', 'it', 'because', 'of', 'its', 'design', 'and', 'form', 'factor', 'and', 'ya', 'a', 'build', 'quality', 'obviously', 'and', 'easy', 'for', 'one', 'hand', 'use', 'and', 'performance', 'u', 'know', 'it', 'damn', 'good', 'and']","['best', 'phone', 'ive', 'ever', 'use', 'best', 'valu', 'money', 'u', 'hdfc', 'card', 'unbeat', 'aaha', 'u', 'display', 'one', 'plu', 'would', 'best', 'price', 'u', 'dont', 'care', 'display', 'u', 'look', 'long', 'term', 'flawless', 'usag', 'best', 'one', 'u', 'see', 'person', 'kinda', 'love', 'design', 'form', 'factor', 'ya', 'build', 'qualiti', 'obvious', 'easi', 'one', 'hand', 'use', 'perform', 'u', 'know', 'damn', 'good']",best phone ive ever use best valu money u hdfc card unbeat aaha u display one plu would best price u dont care display u look long term flawless usag best one u see person kinda love design form factor ya build qualiti obvious easi one hand use perform u know damn good
70,Sambtripathi Tr,valueformoney,4,i hope no doubt in apple productits very great and super if i talking about feature so everything is perfect most important thy is your data security so apple always fallow up to secure your data if you compare android deviceif you want security so no doubt apple is best ,"['i', 'hope', 'no', 'doubt', 'in', 'apple', 'productits', 'very', 'great', 'and', 'super', 'if', 'i', 'talking', 'about', 'feature', 'so', 'everything', 'is', 'perfect', 'most', 'important', 'thy', 'is', 'your', 'data', 'security', 'so', 'apple', 'always', 'fallow', 'up', 'to', 'secure', 'your', 'data', 'if', 'you', 'compare', 'android', 'deviceif', 'you', 'want', 'security', 'so', 'no', 'doubt', 'apple', 'is', 'best']","['i', 'hope', 'no', 'doubt', 'in', 'apple', 'product', 'its', 'very', 'great', 'and', 'super', 'if', 'i', 'talking', 'about', 'feature', 'so', 'everything', 'is', 'perfect', 'most', 'important', 'thy', 'is', 'your', 'data', 'security', 'so', 'apple', 'always', 'fallow', 'up', 'to', 'secure', 'your', 'data', 'if', 'you', 'compare', 'android', 'device', 'if', 'you', 'want', 'security', 'so', 'no', 'doubt', 'apple', 'is', 'best']","['hope', 'doubt', 'appl', 'product', 'great', 'super', 'talk', 'featur', 'everyth', 'perfect', 'import', 'thi', 'data', 'secur', 'appl', 'alway', 'fallow', 'secur', 'data', 'compar', 'android', 'devic', 'want', 'secur', 'doubt', 'appl', 'best']",hope doubt appl product great super talk featur everyth perfect import thi data secur appl alway fallow secur data compar android devic want secur doubt appl best
71,Flipkart Customer,wonderful,5,awesome performance ultimate battery backup super looks in diff colors new look iphone only thind is u need to shed anotherbucks for fast charger,"['awesome', 'performance', 'ultimate', 'battery', 'backup', 'super', 'looks', 'in', 'diff', 'colors', 'new', 'look', 'iphone', 'only', 'thind', 'is', 'u', 'need', 'to', 'shed', 'anotherbucks', 'for', 'fast', 'charger']","['awesome', 'performance', 'ultimate', 'battery', 'backup', 'super', 'looks', 'in', 'diff', 'colors', 'new', 'look', 'i', 'phone', 'only', 'thin', 'd', 'is', 'u', 'need', 'to', 'shed', 'another', 'bucks', 'for', 'fast', 'charger']","['awesom', 'perform', 'ultim', 'batteri', 'backup', 'super', 'look', 'diff', 'color', 'new', 'look', 'phone', 'thin', 'u', 'need', 'shed', 'anoth', 'buck', 'fast', 'charger']",awesom perform ultim batteri backup super look diff color new look phone thin u need shed anoth buck fast charger
72,Kashinath Malbannawar,worth the money,4,the product is amazingly good i loved it based on my dayusage camera is definitely the best part of this phone people who dont want to change thier phone fortoyears should buy it considering you will get security updates at least tilland the processor is capable enough to work for nextyears easily,"['the', 'product', 'is', 'amazingly', 'good', 'i', 'loved', 'it', 'based', 'on', 'my', 'dayusage', 'camera', 'is', 'definitely', 'the', 'best', 'part', 'of', 'this', 'phone', 'people', 'who', 'dont', 'want', 'to', 'change', 'thier', 'phone', 'fortoyears', 'should', 'buy', 'it', 'considering', 'you', 'will', 'get', 'security', 'updates', 'at', 'least', 'tilland', 'the', 'processor', 'is', 'capable', 'enough', 'to', 'work', 'for', 'nextyears', 'easily']","['the', 'product', 'is', 'amazingly', 'good', 'i', 'loved', 'it', 'based', 'on', 'my', 'day', 'usage', 'camera', 'is', 'definitely', 'the', 'best', 'part', 'of', 'this', 'phone', 'people', 'who', 'dont', 'want', 'to', 'change', 'thier', 'phone', 'for', 'to', 'years', 'should', 'buy', 'it', 'considering', 'you', 'will', 'get', 'security', 'updates', 'at', 'least', 'till', 'and', 'the', 'processor', 'is', 'capable', 'enough', 'to', 'work', 'for', 'next', 'years', 'easily']","['product', 'amazingli', 'good', 'love', 'base', 'day', 'usag', 'camera', 'definit', 'best', 'part', 'phone', 'peopl', 'dont', 'want', 'chang', 'thier', 'phone', 'year', 'buy', 'consid', 'get', 'secur', 'updat', 'least', 'till', 'processor', 'capabl', 'enough', 'work', 'next', 'year', 'easili']",product amazingli good love base day usag camera definit best part phone peopl dont want chang thier phone year buy consid get secur updat least till processor capabl enough work next year easili
73,Rishi Sabharwal ,classy product,5,cant tell u how good this phone is however if you dont like ios its better to go for the other options like theand onepluspro but if you need to buy an iphone in india there is no better value for money phone than the xr,"['cant', 'tell', 'u', 'how', 'good', 'this', 'phone', 'is', 'however', 'if', 'you', 'dont', 'like', 'ios', 'its', 'better', 'to', 'go', 'for', 'the', 'other', 'options', 'like', 'theand', 'onepluspro', 'but', 'if', 'you', 'need', 'to', 'buy', 'an', 'iphone', 'in', 'india', 'there', 'is', 'no', 'better', 'value', 'for', 'money', 'phone', 'than', 'the', 'xr']","['cant', 'tell', 'u', 'how', 'good', 'this', 'phone', 'is', 'however', 'if', 'you', 'dont', 'like', 'ios', 'its', 'better', 'to', 'go', 'for', 'the', 'other', 'options', 'like', 'the', 'and', 'one', 'plus', 'pro', 'but', 'if', 'you', 'need', 'to', 'buy', 'an', 'i', 'phone', 'in', 'india', 'there', 'is', 'no', 'better', 'value', 'for', 'money', 'phone', 'than', 'the', 'xr']","['cant', 'tell', 'u', 'good', 'phone', 'howev', 'dont', 'like', 'io', 'better', 'go', 'option', 'like', 'one', 'plu', 'pro', 'need', 'buy', 'phone', 'india', 'better', 'valu', 'money', 'phone', 'xr']",cant tell u good phone howev dont like io better go option like one plu pro need buy phone india better valu money phone xr
74,Flipkart Customer,excellent,5,for someone who had been stuck with android all his life this was first ios change the phone bought during big billion days costed aroundwhich again was a pretty well bargain forgb version pretty convenient in use and camera quality is simply amaze the battery issue in x are like non existent here i guess also depends on usage for me who uses it for like maxhours a day it lasts almostdays in single charge maybe i dont use pretty heavy usage apps apart from soc,"['for', 'someone', 'who', 'had', 'been', 'stuck', 'with', 'android', 'all', 'his', 'life', 'this', 'was', 'first', 'ios', 'change', 'the', 'phone', 'bought', 'during', 'big', 'billion', 'days', 'costed', 'aroundwhich', 'again', 'was', 'a', 'pretty', 'well', 'bargain', 'forgb', 'version', 'pretty', 'convenient', 'in', 'use', 'and', 'camera', 'quality', 'is', 'simply', 'amaze', 'the', 'battery', 'issue', 'in', 'x', 'are', 'like', 'non', 'existent', 'here', 'i', 'guess', 'also', 'depends', 'on', 'usage', 'for', 'me', 'who', 'uses', 'it', 'for', 'like', 'maxhours', 'a', 'day', 'it', 'lasts', 'almostdays', 'in', 'single', 'charge', 'maybe', 'i', 'dont', 'use', 'pretty', 'heavy', 'usage', 'apps', 'apart', 'from', 'soc']","['for', 'someone', 'who', 'had', 'been', 'stuck', 'with', 'android', 'all', 'his', 'life', 'this', 'was', 'first', 'ios', 'change', 'the', 'phone', 'bought', 'during', 'big', 'billion', 'days', 'costed', 'around', 'which', 'again', 'was', 'a', 'pretty', 'well', 'bargain', 'for', 'gb', 'version', 'pretty', 'convenient', 'in', 'use', 'and', 'camera', 'quality', 'is', 'simply', 'amaze', 'the', 'battery', 'issue', 'in', 'x', 'are', 'like', 'non', 'existent', 'here', 'i', 'guess', 'also', 'depends', 'on', 'usage', 'for', 'me', 'who', 'uses', 'it', 'for', 'like', 'max', 'hours', 'a', 'day', 'it', 'lasts', 'almost', 'days', 'in', 'single', 'charge', 'may', 'be', 'i', 'dont', 'use', 'pretty', 'heavy', 'usage', 'apps', 'apart', 'from', 'soc']","['someon', 'stuck', 'android', 'life', 'first', 'io', 'chang', 'phone', 'bought', 'big', 'billion', 'day', 'cost', 'around', 'pretti', 'well', 'bargain', 'gb', 'version', 'pretti', 'conveni', 'use', 'camera', 'qualiti', 'simpli', 'amaz', 'batteri', 'issu', 'x', 'like', 'non', 'exist', 'guess', 'also', 'depend', 'usag', 'use', 'like', 'max', 'hour', 'day', 'last', 'almost', 'day', 'singl', 'charg', 'may', 'dont', 'use', 'pretti', 'heavi', 'usag', 'app', 'apart', 'soc']",someon stuck android life first io chang phone bought big billion day cost around pretti well bargain gb version pretti conveni use camera qualiti simpli amaz batteri issu x like non exist guess also depend usag use like max hour day last almost day singl charg may dont use pretti heavi usag app apart soc
