,User Name,Heading,Rating,Review
0,Flipkart Customer,Must buy!,5,Really amazing phone by apple .Its come with IOS 13.1.3 it’s have really good features like memoji animoji .😎Simply awesome smart phone👌 I love it😍Thanks apple .Thanks Flipkart.Thanks supercom.READ MORE
1,Vignesh Jayabal,Highly recommended,5,"I have bought the 128GB Product RED version. Being an Android user, it was a different hands-on experience of the XR and Iam really liking it.Display looks great, sound quality is great, camera quality is good and mainly the gaming performance is so smooth and fast and never felt a single frame drop ever.Even though its costly for an ""Budget"" apple iphone, it's worth the money I have spent on this mobile.READ MORE"
2,Vineeth Vasu,Best in the market!,5,"Best ever from Iphone this is my first apple device and i’m very glad that i bought this instead of OnePlues 7proThe phone has awesome battery backup, sound quality,style , and cameraREAD MORE"
3,Akash Singh,Fabulous Product. Love It.!,5,"The phone has a supreme build and a sturdy feel in hands. Coming from a 6S, I felt it was a bit too wide, but It’ll grow on you. The RED is by far the best color among available. And this one is an absolute battery champ and won’t let you down. Charging is also pretty fast if you use a fast charger. I use an iPad 12W charger to top it up and it goes from 10% to 90% within 90 mins. If we take in the factor of longevity of the iPhones (iOS support and updates for atleast next 5 years), this is ...READ MORE"
4,Samit Katiyar,Very Good,4,"After using android for 10 yrs m, i moved to iOS and i must say its very difficult to find n use iPhone...i will come to this later , let me start with features: nice camera but not better than samsung note 8.. display bright n good .. nice sound and very good look... a bit bulky... What irritates me :1. Setting ur fav song as ringtone: torture to do that...2. 90% of good app either wallpaper or ringtones or utility: are paid..3 iCloud only 5gb..4. Not able to migrate chrome bookmarks ...READ MORE"
5,Ashish Bahure,Wonderful,4,"Let’s keep it simple,Phone is damn smooth and if you are coming from Android, you will really notice the difference no matter which smartphone you used earlier.Pros:1. Camera and image processing (portrait modes)2. Battery (7hrs screen on time) i.e. all day battery life3. iOS (If you are coming from Android, you will need 2 days to get used to it.. like gestures and all but once you are into it, there's no way turning back. Animations are refined and you will enjoy them)4. Face ID is su...READ MORE"
6,Flipkart Customer,Wonderful,5,"Awesome ❤️. Just go for it. I am very happy with my decision for buying XR instead of iPhone 8 Plus, X, XS and XS Max. Here are the comparisons among these models which made it easy for me to decide to buy this iPhoneScreen:1. This iPhone has HD screen but others have full HD. Still it doesn’t disappoint me while watching full HD video.2. Perfect screen size, Not too big(8 Plus, XS Max) and Not very small(iPhone X or iPhone XS). Design:1. All these models (except 8 plus) have new iPhon...READ MORE"
7,AAKASH  SIMSON,Great product,5,"I feel as if the people who gave the iPhone XR low ratings either didn't know what they were getting or didn't do research. I did a lot of research about the XR by watching a lot of Youtube videos of what the XR had to offer and the changes made from the previous iPhone models. The first thing is that the XR doesn't have a Finger Print Home Button, instead it uses Face Recognition to unlock it or a Pin Code. Second thing is that the Control Center has moved from swiping up from the bottom to ...READ MORE"
8,Shailendra Singh Rawat,Brilliant,5,"Shifted from iPhone SE to XR .....a sea change .  The Camera both front and rear are amazing with fantastic editing options . The Face ID makes unlocking phone apps etc so smooth , the size is also just right ...anything bigger than this should be called tab . The screen resolution is good . I am enjoying my iPhone XR,READ MORE"
9,Vivek  Soman,Terrific,5,"Frankly speaking I was hesitating to place order online for such huge amount phone but the exchange facility, committed delivery time and the packaging is absolutely fine. Thanks to  Flipkart. Talking about the phone - I switched to iOS for the first time. I am One plus lover but I didn’t want to pay to Chinese product hence got this amazing made in California and assembled in India product. Smooth touch, ease of handling and good battery life is giving nice experience. Value for money!READ MORE"
10,Thaseem Y,Highly recommended,5,"I’m upgrading from iPhone SE, the things i liked in iPhone Xr isBrilliant super bright display Great performance Good battery backup Good camerasBigger screen Thing I don’t likeIt is much heavy. I feel the wight.Bezels are a bit thickNo HDR video support for displayNo gigabit LTE as in Xs or Xs max3GB RAM compared to 4GB in X, Xs, Xs maxNo 3D touch - even iPhone 8  and 8+ has 3D touchBlacks looks greyish in the darkNo finger print scannerBasic android features are still missin...READ MORE"
11,RAHUL DHIMAN,Classy product,5,"Once again , very very happy with the product. 100% genuine and timely delivery. Thanks a lot flipkart. Happy to shop from here. Highly recommend everyone to go for this product. Worth buying.READ MORE"
12,shaan alam,Awesome,5,"I have been using it from last 4 months and are fully satisfied with it. I had purchased it from flipkart and everyone knows that its price is much higher compare to the android phone having almost same features. But everything on an iPhone is premium . Looks great in Corel colour, battery last for full one day. Camera is awesome. Although display is not LED but still it looks great. Sound quality is great. No fast charger in the box may be a con. No heating issue at all,high end games works ...READ MORE"
13,Flipkart Customer,Wonderful,5,it's a fantastic way to manage your communication very smartly with awesome Smooth touch...it's an amazing experience to use iPhoneREAD MORE
14,Rishav Bose,Worth every penny,5,"One of the best(so called budget) iphone ever... Awsome build quality. Every one complaining about the screen, yes it's an lcd display with HD resolution but it's not that bad, it's a good display very bright & colour accurate. The camera of this phone is just awsome, sound quality is very good(thanks to the stereo speakers) & performance is too good A12 bionic is dazzling fast. Only disadvantage's are, no portrait mode for object's & the bazels are thicker than it's bigger brother. Overall I...READ MORE"
15,Flipkart Customer,Excellent,5,super camera outstanding processor but battery life is not better nice phone like itREAD MORE
16,Shafir Khan,Terrific purchase,5,"Apple I Phone XR Really Nice One, worth for the money, loved it. Thanks to Flipkart for fast delivery!READ MORE"
17,Sumitra Kamila,Worth every penny,5,"The best mid-range iPhone. The overall performance is excellent. The screen size is perfect, neither too small nor too large. Gesture control is amazing. Face ID is extremely fast. Battery life is sufficient for full day use. Highly recommended for people who are upgrading from iPhone 8 or lower.READ MORE"
18,Flipkart Customer,Super!,5,"Writing this review after using iPhone XR for almost six months, a total value for money phone. Battery performance is pretty nice in comparison to other iPhones.Camera is superb. Looking forward for iOS 14 update. I would recommend to buy XR instead of SE2 .READ MORE"
19,Ajay Kabadi,Wonderful,4,😍😍 My 1st iPhone and really i love itt.... I moved android to iOS and its very good experience ..new gui and new things.specially i love 😍 the display...READ MORE
20,Abhijeet Kumar,Terrific,5,Excellent performance. Upgraded from iphone 7 to iphone XR . No issue in ios . Good decision for Iphone XR while choosing Chinese company ( one plus 8 pro) . Fully satisfied 🤙🏻🔥READ MORE
21,Flipkart Customer,Terrific,5,"Awesome smart phone.... Loved it.Big display, awesome battery backup, Monster sounds, great colour, Apple durability what more u want.READ MORE"
22,Aravind Tejaswi Kandadai,Wonderful,5,Great phone at Great Price point.. Most affordable iPhone.. loved itREAD MORE
23,Ankur Jain,Very Good,4,"Looks are great. The UI is really smooth and lag free. Due to absence of useless gimmicky features, its easy to use. Great cameras. Good display. Really a great device. On top of all, Apple assurity!! Updates, stability, virus/malware free.READ MORE"
24,Shayan Chakraborty,Highly recommended,5,"After using for 6 months, I would just like to say that after using iPhone, u would not like android again. Specially talking of iPhone XR, this is the first iPhone with excellent battery backup, camera, usage and sound.READ MORE"
25,Ajinkya  Awalkar ,Worth every penny,5,Excellent Product!!!Pros :+ Long lasting battery + Flawless portrait mode (front and rear)+ Dual sim support + Price is Worth Cons :- No OLED display - No Full HD- Bit heavy Caution: There are few smudges/stains on my screen which are not getting cleaned. However there is no functionality impact nor it’s visible until you see in tilted. Currently I am following up with Apple care to get it fix.READ MORE
26,Aparna Dalvi,Worth the money,4,Value for money...the performance is good.camera clarity is too good. As I am a android user it was quite struggling to start with iphone xr. But with help of the YouTube it was simple to start with it. Flip kart delivery was before time thank for the fast service. I had ordered iphone xr on 22nd August 2020 and received it on 24th August 2020 superfast delivery thank you very much as it was my birthday gift and my birthday was on 25th August 2020. We were very like will receive it on time or...READ MORE
27,Sheikh Irfan Hasmi,Good quality product,4,"Glad I had bought this phone at 45k before the process went up.Performance is top notch, the A12 BIONIC chipset is a beast.Camera is great and HDR kicks in automatically to bring that extra detail in the photos and videos.Highly recommended.READ MORE"
28,Sudhanshu  Kumar ,Super!,5,"Awesome IPhone.My first IPhone. Am very happy 😃 IOS 13.6(updated)Battery one dayDisplay good enoughCamera awesome, uploaded some picsPerformance awesome, No lag in PUBG. Also having 3D Touch which is awesome.Overall Full pack, love it 😍 Thanks AppleThanks FlipkartREAD MORE"
29,Ankit Kumar,Classy product,5,Yaar I am speechless. It’s a stunning phone and will be a stunning phone for the price tag. It’s a HD pannel but trust me you can’t be able to tell weather it’s HD or Full HD pannel. Baaki toh yaar bas itna hee bol skta sirf use krne ke baad hee samjh me aayega kya cheez hai ye.👌READ MORE
30,Rupesh Ranjan,Mind-blowing purchase,5,"Excellent battery backup, Stunning camera,Premium looks.. Thank you FLIPKART for such fast delivery.. A worthy cause for purchasing an iPhone Xr.. Awesome 👍🏻READ MORE"
31,Sharad Mishra,Very Good,4,I wanted very secure phome in this time when cyber crime is going to upscale. There is no phone in market above 30000 which provide chip level security. ios is more secured than android no doubt. So it was a wise decision from my side to choose iphone xr with decent battery life and every year update i am sure upto 2025. So anybody who think of having a fast phone with security can go with iphone xrREAD MORE
32,Gautam Kumar,Highly recommended,5,Camera is too good.battery backup is also good.i was android user.but now feeling happy using iPhone.ios is too good than android. No bloat ware in iOS. Compact size.easy to use single hand.dont buy one plus 7t and Samsung s10 lite.READ MORE
33,umeshkumar kumar,Awesome,5,very nice phone my first I phone experience good looking and sturdy I like itREAD MORE
34,Jyotirmoy Choudhury,Just wow!,5,"My second iphone after 6S. It's really a beast. After two years from date of launching still it's ahead of most of the android phones. If anyone is confusd between OnePlus and iphone than go for iphone. I have used 6S for four years, did not found any lag even with very heavy usage and after that I sold it at a decent price. Resale value is always great in iPhone. With great price we get a very decent product.READ MORE"
35,Raushan Raj,Must buy!,5,"Upgraded to the new iPhone XR from Apple iPhone  6S .I bought the Product red , as usual Iphone is robust , Colour is good , Display is awesome  and battery is running more than 30 hrs with normal use...over all too good , got delivery in 3 days with flipkartREAD MORE"
36,Ujjvala Collins,Terrific,5,"One of the best decisions I have ever made. When I switched from android to iOS, I thought it’s going to be difficult but it wasn’t. This phone is amazing. It’s fast, have a great battery life, awesome camera (inspite of no night mode, which I don’t need) and flawless performance. Perfect!READ MORE"
37,Abhishek Roy,Value-for-money,4,"Now used for almost a week. Performance is great with A12 bionic chip. Almost no lag. Battery lasts for a day with normal usage of online streaming, social media, gaming. Camera is good with great colour accuracy but low light performance is not as expected considering the premium pricing. Overall decent using experience. Blue colour looks cool without case, though one should use case to avoid scratches and glass breaks from unwanted falls. Though 3 gb ram but ram management is excellent. Hap...READ MORE"
38,Sahil Pradhan,Terrific,5,"Ok...So I decided to get a phone launched in late 2018 in March 2020.  What made be buy this? Well for one... superb build quality... 5 years of software updates.. so should get updates till 21/22. Great display even though it’s a LCD one but make no mistake... it looks and feels amazing. As Apple releases only one series per year its fairly new. IOS is a breeze to use especially in times of MIUI,Colour OS, Funtouch OS. I kept contemplating whether to buy the future proof realme X50 pro 5G or...READ MORE"
39,Vaibhav Chikhle,Fabulous!,5,"Close your eyes and go for it. The best one for this price point. Everyone was speculating about the screen let me tell you won’t notice a thing the screen is gorgeous and bright. This thing is a beast in terms of processing power and battery, you can easily end a day with single charge and still get a 40% at the end of the day. In my opinion this phone will last you for atleast 4 years considering the power it house. Go for it.READ MORE"
40,nandu jasthi,Worth the money,4,When we are getting many features at lowest price ... I don’t feel it’s worth spending more than 55k .... as usual apple products are best in performance and all other aspects except price .... go for it if you can’t use any other mobile other than iPhoneREAD MORE
41,Nuaa Rawat,Really Nice,4,"Bought this 3 days back and using it heavily.Charging : Takes 1.30 Hr for a full charging, though apple did little Kanjoosi here, they should have provided the fast charger but anyways its also fine. No issues at all.Battery: one day usage It’s good I played Pubg for 4 hours straight , surf social sites for 2 hours, you tube 1 hour and other stuff like book reading, wynk and all.. so at the end I was left with 9% battery. So ya its good.Camera : similar to XS but slo mo is bit shaky. Rest...READ MORE"
42,Priya Vibhuti,Worth every penny,5,Awesome phone. I switched from android to iPhone and I must say it is a great experience and feels so good to be an iPhone person 😎😊READ MORE
43,Kamal Lochan Nayak,Classy product,5,Excellent one with very good battery backup.only demerit is it takes too long around 3 hours for full charge . Fast charge is not available.READ MORE
44,Umesh Karape,Best in the market!,5,"It’s just amazing phone, camera is up to the mark not a extremely good you will get natural photos. Battery life is good, touch pad is so good you will just love it. Overall response is good those who are thinking to buy a phone on an around 45k, it will be a great choice.READ MORE"
45,Prashanth Budi,Terrific,5,"1) Awesome Display - Yes i had done lot of research and people out there were saying about it pixel density, but in reality when you hold this side by side to any phone you will be surprised how good the phone actually is. 2) Speed - It is just super duper speed, you will be surprised to see that it handles 30-40 apps without tiny lag3) Camera - Though it has single lens, it is far better than those andriods having 48MP's. 4) Battery -  This is big advantage of buying this phone as it has ...READ MORE"
46,Adit Kapoor,Delightful,4,"The phone was a gift for my father. Apart from being on the heavier side, I didn't find an issue with the phone. The hardware, fit and finish and display are spectacular in every way. My Dad being a music lover claims that this is the best sound quality he had ever experienced on any other mobile device! Price could have better though. I still feel the product is overpriced even though I purchased for 54k after heavy discounts. But as long as my father is happy, all is forgiven! :)READ MORE"
47,Anuj Sharma,Wonderful,5,"This is my first apple product and it’s truly worth the price. Sooner than expected delivery by flipkart, the phone was received in brand new condition and I checked the warranty and authenticity on apple’s site and it’s genuine. iOS is so smooth and amazing, Face ID works like a charm and given the updates till 2023 this phone is the best in 2020. This won’t disappoint you at all. I had heard a lot of criticism about the display but it’s just amazing, a normal consumer won’t bother about lcd...READ MORE"
48,MANOJ MANE,Great product,5,After discount at 54000 this mobile is best due to top class built and best ever OS. Very good camera .READ MORE
49,Vikky Kumar,Very Good,4,Everything is great about the phone except the display. Feels premium.Camera is good but portrait mode works for Human pic only. Display is like 10k android phone.READ MORE
50,Flipkart Customer,Must buy!,5,Awesome Working... But internet speed is low. Battery backup only 1 day. Without internet 2 days. It is working very brilliant.  Camera is outstanding like video & Photo shoot camera.❤️READ MORE
51,Rohit Singh,Must buy!,5,super awesome at first i was a bit tensed that is this a genuine one as i have never shopped for such heavy price from flipkart but i was nore than happy n satisfied but i guess the delivery took a little longer timeREAD MORE
52,Fahad Rehman,Value for Money,5,"I have been using iPhones since iPhone 4 and I bought this one for my daughter as a gift. Great OS, awesome camera, good battery and amazing built. I was doubtful about the HD LCD Screen but surprisingly the quality is very good and there is no visible pixelation.READ MORE"
53,Prakhar Gupta,Terrific,5,I buy this phone for my father as he always love to use Apple products (I don't know why but he love to use). So I ordered this one for him. The overall work performance is very good. The picture quality is mind blowing. After using around 7-8 months. He is still happy with this phone.. So this a great phone to go for..READ MORE
54,Soujanya,Worth every penny,5,"Amazing phone with a very powerful battery. Its the most practical iPhone. Though it has a LCD display it still feels premium n feels the best. It's the best choice if being upgraded from iPhone 7 or 8 or any lower iPhone models. Nothing to think of it its the best in the range, the camera, the built, the battery are really powerful.. A worthy purchaseREAD MORE"
55,Flipkart Customer,Classy product,5,"Frankly this is my 1st review, and Generally In every 6months to 1yr I will change my phone..Almost I used all brands(including Apple phone before to This XR) I never feel the smoothness performance and battery life in any other mobile like this in the iPhone XR..This is the performance beast..I don’t use camera much so I’m neutral about it.But camera Quality is Super.. I Really Love this phone.. I’m sure I’m not gonna change this mobile for min 2yrs. I’m enjoying allot. Thanks to the Flip...READ MORE"
56,MOHIT PATIL,Nice product,4,"Almost used iPhone XR for more than a month now. And overall it’s a great package from apple. Value for money product. Great performance, Great Camera & Display.READ MORE"
57,Nisanth Reddy,Worth every penny,5,Terrific purchase with amazing battery life. Single and powerful camera. No need to spend 20k extra for dual camera. Display should be 1080p. Value for money with amazing performance. Soes the job. Battery backup is awesome. Migrated from android to iosREAD MORE
58,VIJAY  KUMAR,Terrific purchase,5,It’s my first iPhone and trust me android has nothing like this hardware and software best of bestREAD MORE
59,Ragul,Mind-blowing purchase,5,"My first iPhone, i moved it from android and its very worth in every aspect. Camera is natural and its performance, battery is like beast. Totally i loved alot..... ♥️♥️ XR 🔥READ MORE"
60,Customer  C,Terrific,5,Nice performance. Face id is really quick  and battery is ok. Ear phones are good. Overall a great buy even in 2020. I can say a best budget iphoneREAD MORE
61,Kirubha sangar S,Terrific purchase,5,Best product. Worth the money. Great performance and display is very good. Best software experience with regular updates and support.READ MORE
62,Prabhakaran UVP,Fabulous!,5,Awesome phone from appleBest camera quality Best screen resolution (forget about the pixels)Great sound outputFace recognition will be an awestruck feature in this phoneAbove all apple user interface is at its best in XRThank you flipkart & apple for delivering this productREAD MORE
63,Suraj Mondal,Nice product,4,Some time there is a network problem. Price is very high as Compared to other phone which is available in market. If ur iPhone lover the u can go for it. It is better then iPhone XS.READ MORE
64,Cherian Joseph,Perfect product!,5,One the best iPhone out market. Trust me the display is one of the best with most accurate colour reproduction. In terms of speed its like a monster with excellent battery life which can last upto a day and a half for a moderate to heavy use.READ MORE
65,S Ranjithkumar,Really Nice,4,"Phone is good for the first time user of iPhone but not for the other iPhone user who thinks its latest version compared to 8plus this will be degraded version of apple , i donno y this one is not even a full hd display? Its lukg lyk below 10k android phones display, no 3d touch is tolerable bcaz i wont use ofter, upgraded were processor which is a sec faster than a previous nd camera even single portrait was fabulous but viewing that image in this display was lukg bit bad if we transfer that...READ MORE"
66,K.P. PRADEEP,Highly recommended,5,Awesome phone as apple always rocks and Flipkart super fast delivery made my day. phone is superb no lags and battery backup is also superb. I suggest to buy although price is slightly higher but it is ok when u strat using this phone.READ MORE
67,Flipkart Customer,Nice product,4,"Good phone not bad, felt happy on purchasing with Flipkart, but to get this product for me it takes 10 days to get from the Ekart logistics, please be quick with process intimate customer in a proper way of shipping goods..Camera _ 4Performance_4Battery_4Display_3Overall - 4/5READ MORE"
68,Sujay V,Classy product,5,First of all thanks to flipkart for giving a very good product 8 years use of android now I m shifted from Android to iOS Regarding product Iphone XR is best and value for money Compared to android Use of IOS is awesome but first 2-3 days you will face some difficulty how to download apps How to use all apps once you aware about iOS you will never think of androidFriends phone is very fastBattery and Display also very good why i didn't know some people are telling display is not good....READ MORE
69,Shivam Das,Best in the market!,5,"The best iphone I've ever used...the best value for money at 50k(approx)..if u have hdfc card...then at 45k unbeatable,  aaha if u are up for the display...then oneplus 7pro would be best at this price but if u dont care about the display but if u are looking for long term flawless usage...the best one is here which u see above. Personally kinda love it because of its design...and form factor and yaa build quality obviously, and easy for one hand use..and performance u know it damn good...and...READ MORE"
70,Sambtripathi Tr,Value-for-money,4,"I hope no doubt in Apple product.it's very great and super. If I talking about Feature so everything is perfect most important thy is your data security. So Apple always fallow up to secure your data, if you compare Android device.If you want security so no doubt apple is best .READ MORE"
71,Flipkart Customer,Wonderful,5,"Awesome performance, ultimate battery backup super looks in diff. Colors. New look iphone... only thind is u need to shed another 4500 bucks for fast charger..READ MORE"
72,Kashinath Malbannawar,Worth the money,4,The product is amazingly good. I loved it based on my day 1 usage. Camera is definitely the best part of this phone. People who don't want to change thier phone for 2 to 3 years should buy it considering you will get security updates at least till 2023 and the processor is capable enough to work for next 2-3 years easilyREAD MORE
73,Rishi Sabharwal ,Classy product,5,"Can't tell u how good this phone is. however if you don't like iOS it's better to go for the other options like the S10 and OnePlus 7 Pro. but if you need to buy an iPhone in India, there is no better value for money phone than the xr.READ MORE"
