,User Name,Heading,Rating,Review
74,Flipkart Customer,Excellent,5,"For someone who had been stuck with Android all his life, this was first IOS change. The phone bought during big billion days costed around 40k which again was a pretty well bargain for 128 gb version. Pretty convenient in use and camera quality is simply amaze. The battery issue in X are like non existent here (I guess also depends on usage). For me who uses it for like max 3-4 hours a day, it lasts almost 1-1.25 days in single charge (maybe I don't use pretty heavy usage apps apart from soc...READ MORE"
75,Prashanth MS,Brilliant,5,"9-Aug-2019: My first brave step to choose iOS and I don't repent my decision. 1. Compared to Android iOS is so smooth. Super fluidic response and also the security is great. 2. Moving from Android, you need a lot of time to get used to iOS as it's not as easy usage as Android. 3. Activated airtel eSIM in just 2 hours which works exactly like physical SIM.Disadvantage: There is no finger print reader. This could have been given behind where the apple logo is making it almost invisible to ...READ MORE"
76,Ashish Lamba,Highly recommended,5,Awesome product my first purchase of iphone is iphone cr I am so happy with the performance of the mobile phone A issue that i think is network problems and battery backup is very good but not excellentBut this is my first iPhone purchase i am so happy with my mobileREAD MORE
77,Sankalp Jaat,Fair,3,After 15 days of usage rear camera is good front camera is ok. U wont notice HD display until u consume some media display is noticeably less sharp in youtube videos battery life is goodREAD MORE
78,Harsh Mishra,Fabulous!,5,I really loved this everything is perfect in this device also flipkart gives me a good support and best service.READ MORE
79,Srinjoy Guha,Wonderful,4,"Honest review after extensive use of 1 month.1. Battery backup is awesome. With internet on whole day and maximal use, battery percentage at end of the day is around 30-40%. This is so far the best battery I have seen in any apple product.2. Ease of access is also good. Especially the face id makes your locking and unlocking, payment experience smooth and joyful.3. Sound quality is awesome and with a screen size of 6.1 inch, serves a lot if you're watching a movie.4. Camera is not up to t...READ MORE"
80,sunil rao,Brilliant,5,Fantastic beast it is. Looks stunning just upgraded from iPhone 7. In between I used pixel 3 but I am not satisfied so I returned back to I phone family.READ MORE
81,Haresh Desai,Worth every penny,5,"Delighted after having such master piece in hand, owsome phone in all sense. iPhone is truly the best, happy that I replaced my “Chinese” phone.READ MORE"
82,Rajaiah Patnam,Just wow!,5,"Really I couldn’t stop thinking abt phone all the time man it’s beautiful consistent and super fast ,my first experience with iPhone and I’m having fun thanks a lot to Flipkart for delivering product in time and seller had it perfectly packed I’m very happy with the purchaseREAD MORE"
83,Flipkart Customer,Fabulous!,5,"After searching for 5 months i got the best phone in 2020 which is indeed a 2018’s launched phone. The processor, camera and battery is much better than i phone X. And obviously the value of money factor in comparison to i phone 11. Great !!READ MORE"
84,Ayush  Chauhan,Perfect product!,5,Fast delivery by flipkart mobile is fantastic for this price range camera is awesome and pubg plays smoothly ....not sure about battery will update about it later....go for it.READ MORE
85,Flipkart Customer,Classy product,5,Phone is awesome... takes time to charge almost 3:30hours to get 0 to 100% although supporting fast charge but you have to purchase a genuine 18 w charger for it. Camera is overall good. Premium looking phoneREAD MORE
86,Flipkart Customer,Terrific,5,This is my first iphone and i would say its awesome . Camera is very good Battery life is really awsome its stands more than 1 and half day .Phone is really very smoth when you play Pubg while opened multiple apps in background.READ MORE
87,Himanshu Rai,Highly recommended,5,Best iphone in this budget Gives a feel of premium phoneCamera is excellent Battery once charged gives a full day usage to normal userIt is worth buyingREAD MORE
88,Flipkart Customer,Brilliant,5,iPhone is best phone I love it good performance nice cameraREAD MORE
89,Prasaanth Mani,Highly recommended,5,"I got this beautiful machine bought on Big billion sales, this is excellent comparing to Android, this is first time I’m using ios...the performance is buttery smooth AF🔥,highlight for me is the price ... Thank you Flipkart!!!READ MORE"
90,Saurabh Srivastava,Terrific purchase,5,It has been wonderful experience using this phone and going back to Apple. This my 8th iPhone and it still amazes me with its ease of use and simplicity.READ MORE
91,Anurag Tripathy,Simply awesome,5,"Battery management of IPhone XR is pretty good having 6hr screen time. I guess 3GB Ram is sufficient for this phone as I don’t see any lagging. But again it depends how you use the phone.Camera is quite impressive. And if you have doubt against look wise and then ya that BIG NOTCH will make you irritate. It supports wireless charging too. It’s heavy comparable to Redmi or one plus , Due to build design.READ MORE"
92,Flipkart Customer,Wonderful,4,"The Iphone XR has a great camera, good processor and a very good body finish. But the battery backup isnt yet that great. If you use your phone for normal usage like instagram music WhatsApp it lasts for 6-7 hours at max. Battery drops by 1% every 2-4 minutes. The  battery is a big issue when it comes to regular users. Rest all works awesome.READ MORE"
93,ashish manna,Highly recommended,5,"AwesomeBattery back up - full day net on WhatsApp live location on 9am to 10 pm , at 11.30 20% remaining4k Vedio smoothly playingNo heating issueCamera equivalent to DSLR , some pop up camera in the market like 48mp its 12 on xr but 1000% better than that.Red is awesome ( Name Product Red, have a nobel cause also help the cancer patient )hot spot sharing also greatI think its better than oled, amoled, Displayits very Smooth to veiw ( just like Plasma TV  vs Led TV )READ MORE"
94,John B  Pao,Terrific purchase,5,"Classy Phone.For people out there still confused about this phone, don’t even have a second thought, just grab right away.Its been a couple of days I got this phone and I’m totally in love with it. Thank you Apple and thank you Flipkart for the quick delivery.READ MORE"
95,Pratim Sen,Really Nice,4,"What? Nope, I didn't sell my kidney, because I am rich. But not that rich, else would have bought iPhone 11 Pro Max XS Ultra whatever.So what's good in this phone? People think I am Ok Rich. And it looks like the same iPhone 7 I had earlier. Even same wallpaper. What's Bad? My living room doesn't have the LG 4K 55"" TV I wanted cos I spend the money on this one.Should you buy? Yes, else how will Tim Rob Jobs Cooks or any Apple employee  will buy the next Tesla? With your money of course.READ MORE"
96,Notanoob,Awesome,5,Battery backup :I have been a android user since 2010 and used many android phones this last decade both high end and low end ones and I never had a mobile last me 2 full days of usage!Android vs iOS :I want to point out both android and iOS have their merits and demerits but as a consumer we should know exactly what we need in a phone before deciding on the Os . iOS is comparably slow to android but that's just the extra animations in iOS you could equate iOS to oneui or miui in terms ...READ MORE
97,Flipkart Customer,Mind-blowing purchase,5,This Product was such a good Quality. This IPhone XR Deign quality was very nice. & thank to flip kart to give good product and delivery. i am very frequent customer in flip kart. but i bought this product in flip kart i really appreciate the quality of delivery & easy to access online platform to buy such a good product. i suggest all the Apple Mobiles  freaking people buy this product.READ MORE
98,Nishant Sharma,Nice product,4,"Very nice phone with good durable built and colors, screen quality is also very nice. Everything is perfect about this phone except that it is a little heavier as compared to same segment of phones. Also price is on the upper side when compared to similar segment of phones but i guess that's an apple trademark ;)READ MORE"
99,Subhajit Pandit,Excellent,5,"Trust I’m a fan of this device. Probably The best budget product form Apple. Hats off to this device. Top notch performance. Battery is awsome. You may heard that display is not good but trust me you’ll find nothing less in this display. Truly good display quality, and as it’s a lcd display it helps to reduce the battery usage much more than any other amoled display and neither it will hurt ur eyes. Just go for it.READ MORE"
100,Hariharan Balakrishnan,Simply awesome,5,"Got it as a gift for my better half on eve of our anniversary. Ideal if one wants to try out iOS after spending long time with Android (for a change in the usage/experience) the phone is available now at a cost effective price, would recommend to go for it!READ MORE"
101,Neeraj  Jalheria ,Terrific,5,"Amazing phone, upgraded from an iPhone 6s and this phone is a beast. White colour looks the best. Playing PubG at extreme frame rate now. Battery life is great can easily last your for two days if you are an average user. With games it lasts for a day.READ MORE"
102,Shyam,Highly recommended,5,Totally satisfied with the phone. Worth a buy if you need a smooth battery efficient mobileREAD MORE
103,Sweta  Verma,What a wow!!!,5,"It's the best phone, It's better than iPhoneX as X have A11 bionic chip and XR have A12, XR has same camera as XS and XS Max. Also with better face reorganization, And the best battery of all.READ MORE"
104,Sweta Mishra,Worth every penny,5,Go for it instead of iPhone 11 you can buy iPhone xr every thing you got the same . Happy with the product but not with ekart because the didn’t exchanged my old phone by making some non sense reasons and also they dot even have a swipe machine in their office the delivery boy said it will be 8-9 pm sir instead you can go office and collect your parcel .. overall phone is pretty good but not happy with ekart servicesREAD MORE
105,Nikunj Sharma,Simply awesome,5,It's an amazing product with high quality camera visibility.... it has a 6.1 inch display that is equal to iphone 11 pro... so it's worth it . N thank you flipcart for the fastest deliveryREAD MORE
106,Rahmat,Just okay,3,Everything good but the main dis advantage is that it will get lot of time to get charged as no fast charging option is availableREAD MORE
107,Nimit Goenka,Terrific,5,I just got my xr from Flipkart the delivery was really quick I got it in within 3 days whereas the expected time was 4-6 days I am iOS friendly user I have using iPhone since iPhone 6 then 7 and now xr The phone is very handyThe phone has a best quality camera although it has a same megapixel that of 7 but still it works more beautifully The display is a bit yellowish due to its OLED display  over all display experience it Gud The battery is much improved in the xr as I frequently play g...READ MORE
108,Ritik Chumber,Does the job,3,Everthing is good but still iphone 7 plus have way more better speakers rather then XR and the camera quality is not very good. Further if you are looking for budge iphone then XR will be the best choiceREAD MORE
109,Bala.SVV NagaSai,Excellent,5,"First time moved to IOS from Android. Excellent performance, great camera, good battery life and excellent gaming performance. Overall fully satisfied with this device. Sound quality is awesome. My rating to this device is 9/10READ MORE"
110,Sunder singh,Just okay,3,"I was using one plus 7 before which is way better and cheaper than iPhone XR in every aspect,better display,better performance, better camera and better battery and more storage.i had to buy this phone simply for the Apple Watch otherwise I would have never bought iPhone XR.READ MORE"
111,Mohammed Usaid,Terrific,5,I love iPhone it’s best mobile for valuable money..always prefer apple family for mobiles.READ MORE
112,Flipkart Customer,Just wow!,5,It’s been almost a month now and I love the experience.. Should buy and yes red color looks super sexy 😁READ MORE
113,Flipkart Customer,Worth the money,4,Nice mobile apps and performance is very good when compared to other China android mobiles in the market. But overall i still prefer android over iOS as it has more customisation . But if you are looking for mobile with great camera and performance then go for itREAD MORE
114,Chethan Chethu,Terrific,5,Excellent phone with high speed processor has very decent features and battery life is best among the iPhone models and also suitable for gaming with good graphic. Overall can buy without second thought.READ MORE
115,Anjali Shukla,Classy product,5,"Upgraded from Iphone 6, and I believe this is a really good deal at this price. Battery is excellent, display is great and the camera is just too good. Gives true natural colours. It would have been good to get the fast charger along with it though. It's also a bit thick.READ MORE"
116,Sathish kumar S,Excellent,5,This is a cool phone. Worth for its price i must say. The user experience is amazing in every aspect i could think of. As Steve Jobs one said design is not not something you feel or see it’s what you work with. i phone never disappointed me except for the price. And this one is worth it compared to other Samsung and google.READ MORE
117,Flipkart Customer,Value-for-money,4,"I loved it. it's beautiful. There's just this heating problem whenever I turn the hotspot on. Also battery isnt that great. You buy you buy a cover aswell, hella slippery. Audio quality is superb. The charging is slow(obviously) but yeah I used the 18w charger for my vivo, there's a significant loss in charging time. Camera is amazing but I wish there was a little more zoom. Face unlock works 98% of the times.READ MORE"
118,Manas  Khuntia,Just wow!,5,Very nice phone my first iPhone got it with a good deal on BBD sales very much satisfied with  the seller and Flipkart for a genuine productREAD MORE
119,Arun,Classy product : Excellent phone for Excellent Price,5,"Awesome.. I liked the blue color, which is better than the image, i usually buy black but happy with blue this time, The Phone is nice and charging is faster.READ MORE"
120,Dinesh Kumar P,Value-for-money,4,Purchased during big billion day...phone was delivered on time. I'm a first time iPhone user..little time taken to adjust to the changes in UI compared to android. Yet to completely understand the advantages of ios..2 major points...camera image quality is too good and color reproduction is excellent. Battery is good and for normal usage I'm getting for 1.5 days.READ MORE
121,Flipkart Customer,Classy product,5,"Really it’s an excellent phone after a week i am writing a review about this Good battery back up , Display is really good as I expected .Over all WOWREAD MORE"
122,Dr.sumit Customer,Excellent,5,"Amazing piece of technology . Amazing camera and good battery life , display is ok and no problems with it ..colour saturation is missing yet beautiful display.READ MORE"
123,Abraham,Must buy! XR is an Beast !!,5,The product is excellent!! Don't even think of neglecting this beast. I would this is the best phone You will get for 40k. Thanks to flipkart for such a superb deal. I was thinking to go for iphone X but I never regret of making a choice to go with Xr. A12 makes the way for a better world. Just go for it man.READ MORE
124,ABHINAV KUMAR,Classy product,5,Thanks flipkart for delivering the product a day ahead. I have one issue though there is a black spot on the rear camera and when I am trying to take a picture it still appears on the picture too.Coming to xr well what should I say... it is a beast. The best battery out there and best performance and frankly what a camera it is. Hats off for ur work apple keep up the good work.READ MORE
125,DILEEP KUMAR SHAH,Value-for-money,4,"Everything is perfectly fine except the display quality and night mode in camera. If there was a amoled display in it and night shot capability, nothing could have been better.Snuggly performance and butter like smoothness are simply the identity of IOS.READ MORE"
126,Flipkart Customer,Highly recommended,5,I upgraded 6s to I phone XR mobile performance is superb good ... but in Flipkart while we are pursuing its showing 10 days guarantee but there is no return the product after purchased 1 day the mobile price dropped to 39900 feeling bad...READ MORE
127,rajendra varma pericherla,Terrific purchase,5,"Very much satisfied with the flipkart deliveryGot it for 36k in big billion day sale Coming to device,1.The performance is mind numbing2.Battery is very efficient though (thanks to the 7nm tech a12 bionic)3.Dont mind the on paper specs of display,the display is crispy enough and supremely colour accurate(dont compare with amoled) and sufficient brightness even in bright sunlight4.Sound quality is awesome in this device both from earpods and stereo built in speakers5.Also no need to say...READ MORE"
128,Nandu  S,Great product,5,"Fabulous device,this is my first iPhone and I’m in love with it already. Good service from Flipkart got it just after one and a half days after orderingREAD MORE"
129,Flipkart Customer,Terrific,5,best phone bit heavy but really worth battery life is really good am really satisfied with phone delivery shipment promptREAD MORE
130,Prabhu N,Just wow!,5,Good phone and Good seller. Classic Awesome Red Colour.READ MORE
131,Susheel  Dubey,Brilliant,5,One of the best mobile. Battery must be stronger than present.camera quality is good. Touching sensors working very good. my overall experience is amazing.Thank you flipkart for you  fast delivery service.READ MORE
132,Biswadeep Pradhan,Wonderful,5,superb phone .Design is very good and very slim.Smooth feather touch display and no lag .There are some new features but not many differences than iphone 6 or older models .Good battery life.What i like is touch sensitive is too good and face id is working perfect .Initially you will miss the home button if you have upgraded from iphone 7 gradually you will be adjusted to the phone and what i find is with out home button phone is great and multitasking also working fine .READ MORE
133,akash pathak,Simply awesome,5,Awesome deviceREAD MORE
134,Chetan  Sharma ,Perfect product!,5,Phone is good and excellent but price is so high😭😭READ MORE
135,NABARUN  SASMAL,Must buy!,5,camera awesomeREAD MORE
136,Pratyashi  Devi ,Simply awesome,5,My First iphone 📱  Feeling Good 😍READ MORE
137,Anjalu Maurya,Excellent,5,Love the red colourREAD MORE
138,Aditya Kumar,Simply awesome,5,"Brilliant iOS 13,  Amazing camera, Excellent battery life, premium experience.  Better than iPhone XREAD MORE"
139,Aswini Kumar,Excellent,5,my first iphone ....im so happy ...its a complete package..i love it ❤️❤️❤️READ MORE
140,Bhushan  Chaudhari ,Worth every penny,5,Awesome.  Gadget .... PowerFull Device..READ MORE
141,Sipun Kumar,Terrific,5,Amazing.READ MORE
142,Solomon  Raj,Must buy!,5,Apple🍎iPhone XR was Excellent & BrilliantREAD MORE
143,Rishu Kumar,Classy product,5,I am very happy to buy this phoneREAD MORE
144,Deepak  rao ,Super!,5,super and geniusREAD MORE
145,bhanu varma,Terrific,5,"Switched back to ios after 5 years, feels so smooth and looks premium, purchased this on offer for 55000, its performance is beyond expectation, great haptics feel, totally value for money if you purchase in discount.READ MORE"
146,Flipkart Customer,Just wow!,5,I got best nd lowest price 39487/- for iPhone xr 128 GB.READ MORE
147,Tania Biswas,Classy product,5,just awesomeREAD MORE
148,Shekhar Suman,Nice,3,Nice phone (Coral)READ MORE
149,Akash R,Wonderful,5,💫 Amazing 💫READ MORE
150,cherry prathipati,Simply awesome,5,Osm Mobile 👌🏻👌🏻👌🏻😍😍READ MORE
151,Flipkart Customer,Very Good,4,Best mobile go for it blindlyREAD MORE
152,Krishna Mohan,Terrific,5,Simply awesome no words to speakREAD MORE
153,Mousumi  Maity,Brilliant,5,awesome ❤️READ MORE
154,Mohammed Aslam,Classy product,5,WooooooW !!!! Finally bought a iiiiiiphone....This is my 1st iphone !!😄😄😄😄Super 📱 phone Smooth performance 👌Battery backup was was awesome 👏🏼 🔋 Camera 📷 with depth control was fantastic 👍🏼Feeling Soooooo Happeeee and statisfied with this model 😄😄😀😍😍😍Face ID was awesome  to unlock with in a sec even in the dark 👏🏼👏🏼Worth buy 👌📱READ MORE
155,Deo Ankit,Highly recommended,5,AwesomeREAD MORE
156,Sumrendra Singh,Awesome,5,"Excellent camera, battery and performance! 👍READ MORE"
157,Flipkart Customer,Value-for-money,4,Happy to hold and feel iPhone xr.....grt price offered by FlipkartBut am really disappointed to say Flipkart PPL make tempting offer for ur old phone with higher exchange value......but while exchange the delivery guy finds a minute scratch.....very negligible colour fade on the bottom of the phone and he demands the remaining amount to be paid else he will returnI guess we should keep a new unused phone for exchange which should have no scratches or any thing like itBetter to buy in nearb...READ MORE
158,Vignesh V,Great product,5,Most successful model in APPLE .The good thing is everything.but inside the box there is no lightning connector to 3.5mm jack.READ MORE
159,Ashish Chaudhary,Brilliant,5,Awesome mobileREAD MORE
160,Gunja Praveen,Worth the money,4,I love this  nice productREAD MORE
161,Gaurave Varshney,Wonderful,5,After many purchase of android phone finely I decide to by a iPhone I done it and I love itREAD MORE
162,Sanjay Gulati Musafir,Terrific,5,I bought it for my wife. She is happy using a brand name. Luckily I bought Redmi Note 6 Pro within a week and I'm more than satisfied using that despite the fact I also shifted from iPhone.READ MORE
163,Sagar Dixit ,Mind-blowing purchase,5,The phone was repacked.Not satisfied with seller product.READ MORE
164,Saransh Goswami,Awesome,5,Excellent dealREAD MORE
165,MOHAN SUBRAMANYAM,Pretty good,4,Battery performance not good ...otherwise nice mobile ....READ MORE
166,utkarsh,Best in the market!,5,"I got this beast in unbelievable price 36k during big billion days. Camera is awesome, phone is just flawless. i have used iphone 6 and 7 for a long..then switched to android..now get back to ios. Just one thing which i can say is not good that is charging time.READ MORE"
167,Flipkart Customer,Classy product,5,Awesome camera experience 😍😍READ MORE
168,Biswa,Awesome,5,Overall a nice choiceREAD MORE
169,Flipkart Customer,Brilliant,5,Best battery and cameraREAD MORE
170,Flipkart Customer,Brilliant,5,so good I love itREAD MORE
171,A.Anmol Hota,Terrific purchase,5,-sexy colour-this is not a fake iphone-very fast delivery by flipkart-warrenty checked from Apple site-value for money.READ MORE
172,Anand Mukut Tirkey,Amazing product,5,"My first iPhone, amazed by performanceREAD MORE"
173,Pooja Chakraborty,Wonderful,5,Just received it. Its so goodREAD MORE
174,Rudramani Singh,Just wow!,5,great device.Value for money.READ MORE
175,Pramod kumar,Highly recommended,5,super smartphoneREAD MORE
176,Wasim Akram,Really Nice,4,Only one word SUPERB.. But price is too high.READ MORE
177,Rahul Kumar,Awesome,5,it's my Dream Phone....overall This Gadget is superbREAD MORE
178,MANISH DHAYAL,Just wow!,5,What’s a great phone iPhone unbelievable performance with super fast face lock and much more ever ......READ MORE
179,Mayur  Chaudhari,Great product,5,Best phone 🤩READ MORE
180,Loganathan,Useless product,5,Seem there is some issue with this phone mic. I got many complaints from my oponent. I also tried with wifi calling also.READ MORE
181,Rajorshi Chatterjee,Just wow!,5,Using Apple for over 3 years now and have upgraded... Working very fine and thanks to Flipkart Big Billion Days for making me get this product at the lowest price.READ MORE
182,Flipkart Customer,Perfect product!,5,i love thisREAD MORE
183,soumita  mondal,Awesome,5,My first ever iPhone ❤️and I love it❤️😍thank you Flipkart☺️🌸🌈READ MORE
184,Suraj kumar,Best in the market!,5,"Fast smooth, monster performance , battrey is good , pubg ? no naver lag , its not a android Samsung s10 plus Exynos ,A12 bionic engine give monster performance, yes its beat snapdragon 855 , antutu is not matter its appleREAD MORE"
185,Bhanu Pathania,Super!,5,A Great product as it's name says.Loved this purchase...Thanks Flipkart for making me smile again.READ MORE
186,Kingston K,Classy product,5,Vry quick delivery 🚚READ MORE
187,Flipkart Customer,Awesome,4,My first iphone and am so happy 😍🥳READ MORE
188,Raj  Shakher,Value-for-money,1,Super mobile... I'm completely satisfied buy this mobile...🙂🙂🙂READ MORE
189,Kanika Gulati,Utterly Disappointed,1,Not workingREAD MORE
190,himanshu poptani,Wonderful,4,It deserves 10/5 but i am giving 4 star just because packaging of product.How can a brand like flipkart pack an expensive product so carelessly but overall product is 🔥🔥🔥🔥🔥🔥🔥😍obviously it is half bite apple😂😂it is my first iphone thanks flipkart.......Pubg🔥🔥🔥🔥🔥Camera🔥🔥🔥🔥Battery🔥🔥🔥🔥🔥 Pesa wasooooool🔥🔥🔥🔥Baki to abhi 7 din hue h purchase kiye hueREAD MORE
191,Subodh Kumar Gangwal,Simply awesome,5,It’s iPhone and name is enoughREAD MORE
192,allan kujur,Just wow!,5,best value for moneyREAD MORE
193,Ashish Anand,Classy product,5,Best deal ever price @ 44999/-READ MORE
194,Dharani Kharsel,Worth the money,4,Amazing picREAD MORE
195,Flipkart Customer,Perfect product!,5,It's my first iPhone and it's fantastic.READ MORE
